StockCode,Description,Quantity,InvoiceDate,UnitPrice,CustomerID
22668,CHARLOTTE BAG DOLLY GIRL DESIGN,27,12/1/2010 8:52,7.85,12590
21738,RED TOADSTOOL LED NIGHT LIGHT,31,12/1/2010 8:52,8.65,12590
22907, SET 2 TEA TOWELS I LOVE LONDON ,31,12/1/2010 8:52,9.95,12590
21920,VINTAGE SEASIDE JIGSAW PUZZLES,19,12/1/2010 8:52,10.75,12590
22547,MINI JIGSAW CIRCUS PARADE ,31,12/1/2010 8:52,7.42,12590
22551,MINI JIGSAW SPACEBOY,31,12/1/2010 8:52,7.42,12590
22499,MINI PAINT SET VINTAGE ,43,12/1/2010 8:52,7.65,12590
POST,POSTAGE,10,12/1/2010 8:52,25,12590
22093,PAPER CHAIN KIT 50'S CHRISTMAS ,87,12/1/2010 9:07,9.55,13755
22639,HAND WARMER RED POLKA DOT,13,12/1/2010 9:08,8.85,17857
22640,HAND WARMER UNION JACK,13,12/1/2010 9:08,8.85,17857
85130A,WHITE HANGING HEART T-LIGHT HOLDER,13,12/1/2010 9:09,9.55,17857
71060,WHITE METAL LANTERN,13,12/1/2010 9:09,10.39,17857
84413B,CREAM CUPID HEARTS COAT HANGER,15,12/1/2010 9:09,9.75,17857
20686,EDWARDIAN PARASOL RED,13,12/1/2010 9:09,11.95,17857
37377,RETRO COFFEE MUGS ASSORTED,13,12/1/2010 9:09,8.06,17857
21878,SAVE THE PLANET MUG,13,12/1/2010 9:09,8.06,17857
21078,VINTAGE BILLBOARD DRINK ME MUG,13,12/1/2010 9:09,8.06,17857
21075,VINTAGE BILLBOARD LOVE/HATE MUG,13,12/1/2010 9:09,8.06,17857
82490,WOOD 2 DRAWER CABINET WHITE FINISH,9,12/1/2010 9:09,11.95,17857
82493,WOOD S/3 CABINET ANT WHITE FINISH,11,12/1/2010 9:09,13.95,17857
82489,WOODEN PICTURE FRAME WHITE FINISH,13,12/1/2010 9:09,9.1,17857
82501L,WOODEN FRAME ANTIQUE WHITE ,13,12/1/2010 9:09,9.55,17857
84036G,KNITTED UNION FLAG HOT WATER BOTTLE,13,12/1/2010 9:09,10.39,17857
84036E,RED WOOLLY HOTTIE WHITE HEART.,13,12/1/2010 9:09,10.39,17857
22759,SET 7 BABUSHKA NESTING BOXES,9,12/1/2010 9:09,14.65,17857
21737,GLASS STAR FROSTED T-LIGHT HOLDER,13,12/1/2010 9:09,11.25,17857
21265,VICTORIAN SEWING BOX LARGE,39,12/1/2010 9:16,17.95,15107
85130A,WHITE HANGING HEART T-LIGHT HOLDER,13,12/1/2010 9:39,9.55,17857
71060,WHITE METAL LANTERN,13,12/1/2010 9:39,10.39,17857
84413B,CREAM CUPID HEARTS COAT HANGER,15,12/1/2010 9:39,9.75,17857
20686,EDWARDIAN PARASOL RED,13,12/1/2010 9:39,11.95,17857
37377,RETRO COFFEE MUGS ASSORTED,13,12/1/2010 9:39,8.06,17857
21878,SAVE THE PLANET MUG,13,12/1/2010 9:39,8.06,17857
21078,VINTAGE BILLBOARD DRINK ME MUG,13,12/1/2010 9:39,8.06,17857
21075,VINTAGE BILLBOARD LOVE/HATE MUG,13,12/1/2010 9:39,8.06,17857
82490,WOOD 2 DRAWER CABINET WHITE FINISH,9,12/1/2010 9:39,11.95,17857
82493,WOOD S/3 CABINET ANT WHITE FINISH,11,12/1/2010 9:39,13.95,17857
82489,WOODEN PICTURE FRAME WHITE FINISH,13,12/1/2010 9:39,9.1,17857
82501L,WOODEN FRAME ANTIQUE WHITE ,13,12/1/2010 9:39,9.55,17857
84036G,KNITTED UNION FLAG HOT WATER BOTTLE,13,12/1/2010 9:39,10.39,17857
84036E,RED WOOLLY HOTTIE WHITE HEART.,13,12/1/2010 9:39,10.39,17857
22759,SET 7 BABUSHKA NESTING BOXES,9,12/1/2010 9:39,14.65,17857
21737,GLASS STAR FROSTED T-LIGHT HOLDER,13,12/1/2010 9:39,11.25,17857
22121,HOT WATER BOTTLE TEA AND SYMPATHY,55,12/1/2010 9:39,10.45,15298
21740,RED HANGING HEART T-LIGHT HOLDER,71,12/1/2010 9:39,9.55,15298
22639,HAND WARMER RED POLKA DOT,13,12/1/2010 9:41,8.85,17857
22640,HAND WARMER UNION JACK,13,12/1/2010 9:41,8.85,17857
22393,JUMBO BAG PINK POLKADOT,17,12/1/2010 9:44,8.95,14695
85106C,JUMBO  BAG BAROQUE BLACK WHITE,17,12/1/2010 9:44,8.95,14695
21040,JUMBO BAG CHARLIE AND LOLA TOYS,17,12/1/2010 9:44,9.95,14695
20730,STRAWBERRY CHARLOTTE BAG,17,12/1/2010 9:44,7.85,14695
85004B,RED 3 PIECE RETROSPOT CUTLERY SET,19,12/1/2010 9:44,10.75,14695
85004C,BLUE 3 PIECE POLKADOT CUTLERY SET,13,12/1/2010 9:44,10.75,14695
21101,SET/6 RED SPOTTY PAPER PLATES,19,12/1/2010 9:44,7.85,14695
20732,LUNCH BAG RED RETROSPOT,17,12/1/2010 9:44,8.65,14695
21566,STRAWBERRY LUNCH BOX WITH CUTLERY,13,12/1/2010 9:44,9.55,14695
22359,LUNCH BOX WITH CUTLERY RETROSPOT ,13,12/1/2010 9:44,9.55,14695
21219,PACK OF 72 RETROSPOT CAKE CASES,127,12/1/2010 9:44,7.42,14695
21982,PACK OF 60 DINOSAUR CAKE CASES,31,12/1/2010 9:44,7.55,14695
21984,PACK OF 60 PINK PAISLEY CAKE CASES,31,12/1/2010 9:44,7.55,14695
84998,67 TEATIME FAIRY CAKE CASES,31,12/1/2010 9:44,7.55,14695
84526A,TOMATO CHARLIE+LOLA COASTER SET,13,12/1/2010 9:44,9.95,14695
85190B,CHARLIE & LOLA WASTEPAPER BIN FLORA,55,12/1/2010 9:44,8.25,14695
85078B,RED CHARLIE+LOLA PERSONAL DOORSIGN,103,12/1/2010 9:44,7.38,14695
21938,JUMBO STORAGE BAG SUKI,17,12/1/2010 9:44,8.95,14695
21936,JUMBO BAG PINK VINTAGE PAISLEY,17,12/1/2010 9:44,8.95,14695
22968,JAM MAKING SET PRINTED,31,12/1/2010 9:48,8.45,17816
22146,RETROSPOT TEA SET CERAMIC 11 PC ,30,12/1/2010 9:48,11.25,15318
84861,GIRLY PINK TOOL SET,12,12/1/2010 9:48,11.95,15318
22418,JUMBO SHOPPER VINTAGE RED PAISLEY,17,12/1/2010 9:48,8.95,15318
82574,"AIRLINE LOUNGE,METAL SIGN",9,12/1/2010 9:48,9.1,15318
21679,WHITE SPOT RED CERAMIC DRAWER KNOB,13,12/1/2010 9:48,8.25,15318
22781,RED DRAWER KNOB ACRYLIC EDWARDIAN,31,12/1/2010 9:48,8.25,15318
22778,CLEAR DRAWER KNOB ACRYLIC EDWARDIAN,31,12/1/2010 9:48,8.25,15318
71277,PHOTO CLIP LINE,8,12/1/2010 9:48,8.25,15318
22269,FELT EGG COSY CHICKEN,8,12/1/2010 9:48,7.85,15318
22644,PIGGY BANK RETROSPOT ,8,12/1/2010 9:48,9.55,15318
21941,SKULL SHOULDER BAG,17,12/1/2010 9:48,8.65,15318
21176,YOU'RE CONFUSING ME METAL SIGN ,10,12/1/2010 9:48,8.69,15318
21173,COOK WITH WINE METAL SIGN ,8,12/1/2010 9:48,8.95,15318
21182,GIN + TONIC DIET METAL SIGN,9,12/1/2010 9:48,9.1,15318
37451A,YELLOW BREAKFAST CUP AND SAUCER,8,12/1/2010 9:48,9.95,15318
37451C,PINK BREAKFAST CUP AND SAUCER ,8,12/1/2010 9:48,9.95,15318
22093,PAPER CHAIN KIT 50'S CHRISTMAS ,11,12/1/2010 9:48,9.95,15318
22090,PAPER CHAIN KIT RETROSPOT,8,12/1/2010 9:48,9.95,15318
84978S,SMALL HEART FLOWERS HOOK ,13,12/1/2010 9:48,7.85,15318
71277,PHOTO CLIP LINE,10,12/1/2010 9:48,8.25,15318
47587,TEA TIME DES TEA COSY,9,12/1/2010 9:48,9.55,15318
22268,FELT EGG COSY WHITE RABBIT ,8,12/1/2010 9:48,7.85,15318
84839,ZINC WILLIE WINKIE  CANDLE STICK,8,12/1/2010 9:48,7.85,15318
22651,CERAMIC CHERRY CAKE MONEY BANK,8,12/1/2010 9:48,8.45,15318
21540,RETROSPOT LARGE MILK JUG,8,12/1/2010 9:48,11.95,15318
21564,SET OF 6 FUNKY BEAKERS,9,12/1/2010 9:48,9.95,15318
15063BL,EDWARDIAN PARASOL BLACK,9,12/1/2010 9:48,12.95,15318
15063N,EDWARDIAN PARASOL NATURAL,9,12/1/2010 9:48,12.95,15318
22653,CERAMIC STRAWBERRY CAKE MONEY BANK,11,12/1/2010 9:48,8.45,15318
22183,BLUE OWL SOFT TOY,8,12/1/2010 9:48,9.95,15318
22445,BALLOON ART MAKE YOUR OWN FLOWERS,8,12/1/2010 9:48,8.95,15318
21738,RED TOADSTOOL LED NIGHT LIGHT,9,12/1/2010 9:48,8.65,15318
22785,GLASS CLOCHE SMALL,10,12/1/2010 9:48,10.95,15318
22726,GUMBALL MONOCHROME COAT RACK,43,12/1/2010 9:48,8.06,15318
21530,DOORMAT FANCY FONT HOME SWEET HOME,17,12/1/2010 9:48,13.75,15318
D,Discount,6,12/1/2010 9:48,34.5,14534
10009,INFLATABLE POLITICAL GLOBE ,19,12/1/2010 9:52,7.85,16105
21919,VINTAGE SNAKES & LADDERS,15,12/1/2010 9:52,10.75,16105
21839,CHOCOLATE CALCULATOR,19,12/1/2010 9:52,8.65,16105
22418,JUMBO SHOPPER VINTAGE RED PAISLEY,17,12/1/2010 9:52,8.95,16105
22386,RECYCLING BAG RETROSPOT ,17,12/1/2010 9:52,9.1,16105
22388,TOY TIDY PINK POLKADOT,57,12/1/2010 9:52,8.85,16105
22805,ANTIQUE GLASS DRESSING TABLE POT,15,12/1/2010 9:52,9.95,16105
22733,ALARM CLOCK BAKELIKE GREEN,11,12/1/2010 9:52,10.75,16105
22933,IVORY GIANT GARDEN THERMOMETER,19,12/1/2010 9:52,12.95,16105
22846,10 TIER CAKE TIN GREEN AND CREAM,9,12/1/2010 9:52,21.95,16105
22845,10 TIER CAKE TIN RED AND CREAM,9,12/1/2010 9:52,21.95,16105
22790,SET 3 WICKER OVAL BASKETS W LIDS,11,12/1/2010 9:52,23.95,16105
35011C,SET OF 3 COLOURED  FLYING DUCKS,6,12/1/2010 9:56,11.65,15318
82491,WOOD BLACK BOARD ANT WHITE FINISH,10,12/1/2010 9:60,13.45,18081
84762,COLOUR GLASS T-LIGHT HOLDER HANGING,55,12/1/2010 9:60,7.65,18081
22471,HANGING METAL HEART LANTERN,19,12/1/2010 9:60,8.65,18081
21331,HANGING MEDINA LANTERN SMALL,13,12/1/2010 9:60,9.95,18081
22464,NATURAL SLATE HEART CHALKBOARD ,19,12/1/2010 9:60,9.95,18081
22476,HEART OF WICKER SMALL,47,12/1/2010 9:60,8.45,18081
22477,HEART OF WICKER LARGE,47,12/1/2010 9:60,9.55,18081
22231,WHITE LOVEBIRD LANTERN,13,12/1/2010 9:60,9.95,18081
21347,CLASSIC METAL BIRDCAGE PLANT HOLDER,9,12/1/2010 9:60,19.75,18081
22196,CREAM HEART CARD HOLDER,11,12/1/2010 9:60,10.95,18081
22434,ENAMEL FLOWER JUG CREAM,10,12/1/2010 9:60,12.95,18081
22435,ENAMEL FIRE BUCKET CREAM,13,12/1/2010 9:60,13.95,18081
22431,ENAMEL BREAD BIN CREAM,15,12/1/2010 9:60,17.95,18081
22790,SET 3 WICKER OVAL BASKETS W LIDS,8,12/1/2010 9:63,26.95,17427
22968,JAM MAKING SET PRINTED,19,12/1/2010 9:63,8.45,17427
22967,JAM MAKING SET WITH JARS,13,12/1/2010 9:63,11.25,17427
22670,JUMBO BAG DOLLY GIRL DESIGN,17,12/1/2010 9:63,8.95,17427
85056A,TRADITIONAL CHRISTMAS RIBBONS,19,12/1/2010 9:63,8.25,17427
22175,ORGANISER WOOD ANTIQUE WHITE ,9,12/1/2010 9:63,15.5,17427
22669,LUNCH BAG DOLLY GIRL DESIGN,17,12/1/2010 9:63,8.65,17427
84887,WHITE WIRE EGG HOLDER,43,12/1/2010 9:64,11.95,16036
85106C,JUMBO  BAG BAROQUE BLACK WHITE,107,12/1/2010 9:64,8.65,16036
85106B,JUMBO BAG RED RETROSPOT,107,12/1/2010 9:64,8.65,16036
79328,CHILLI LIGHTS,199,12/1/2010 9:65,10.82,16036
22787,LIGHT GARLAND BUTTERFILES PINK,199,12/1/2010 9:65,10.37,16036
22786,WOODEN OWLS LIGHT GARLAND ,199,12/1/2010 9:65,10.37,16036
22473,FAIRY TALE COTTAGE NIGHTLIGHT,439,12/1/2010 9:65,8.45,16036
21738,RED TOADSTOOL LED NIGHT LIGHT,439,12/1/2010 9:65,8.25,16036
21761,HOME BUILDING BLOCK WORD,10,12/1/2010 9:66,12.95,16257
21762,LOVE BUILDING BLOCK WORD,10,12/1/2010 9:66,12.95,16257
21530,DOORMAT FANCY FONT HOME SWEET HOME,9,12/1/2010 9:66,14.95,16257
21370,HOME SMALL WOOD LETTERS,10,12/1/2010 9:66,11.95,16257
21418,GINGHAM HEART  DOORSTOP RED,10,12/1/2010 9:66,11.25,16257
22325,FIVE HEART HANGING DECORATION,13,12/1/2010 9:66,9.95,16257
22471,HANGING METAL HEART LANTERN,19,12/1/2010 9:66,8.65,16257
22922,ASSORTED BOTTLE TOP  MAGNETS ,19,12/1/2010 9:66,7.42,16257
22929,FRIDGE MAGNETS US DINER ASSORTED,19,12/1/2010 9:66,7.85,16257
22976,HOMEMADE JAM SCENTED CANDLES,19,12/1/2010 9:66,8.45,16257
22930,FRIDGE MAGNETS LES ENFANTS ASSORTED,19,12/1/2010 9:66,7.85,16257
21122,ROSE CARAVAN DOORSTOP,11,12/1/2010 9:66,13.75,16257
22476,HEART OF WICKER SMALL,19,12/1/2010 9:66,8.65,16257
22249,12 HOOK HANGER MAGIC TOADSTOOL,19,12/1/2010 9:66,8.65,16257
22948,CHRISTMAS LIGHTS 10 REINDEER,13,12/1/2010 10:10,15.5,12438
21629,VINTAGE UNION JACK CUSHION COVER,15,12/1/2010 10:10,11.95,12438
21798,VINTAGE HEADS AND TAILS CARD GAME ,19,12/1/2010 10:10,8.25,12438
35011C,SET OF 3 COLOURED  FLYING DUCKS,13,12/1/2010 10:10,12.45,12438
35011G,SET OF 3 GOLD FLYING DUCKS,11,12/1/2010 10:10,13.35,12438
85021B,RED RETROSPOT UMBRELLA,13,12/1/2010 10:10,12.95,12438
85021A,BLACK/BLUE POLKADOT UMBRELLA,10,12/1/2010 10:10,12.95,12438
22200,RED DINER WALL CLOCK,9,12/1/2010 10:10,15.5,12438
22733,ALARM CLOCK BAKELIKE GREEN,11,12/1/2010 10:10,10.75,12438
22734,ALARM CLOCK BAKELIKE RED ,11,12/1/2010 10:10,10.75,12438
22199,BLUE DINER WALL CLOCK,9,12/1/2010 10:10,15.5,12438
22198,IVORY DINER WALL CLOCK,9,12/1/2010 10:10,15.5,12438
22202,LARGE HEART MEASURING SPOONS,31,12/1/2010 10:10,8.65,12438
22203,SMALL HEART MEASURING SPOONS,31,12/1/2010 10:10,7.85,12438
22948,CHRISTMAS LIGHTS 10 REINDEER,9,12/1/2010 10:26,15.5,17518
22967,JAM MAKING SET WITH JARS,19,12/1/2010 10:26,10.75,17518
22968,JAM MAKING SET PRINTED,19,12/1/2010 10:26,8.45,17518
22969,JAM JAR WITH PINK LID,55,12/1/2010 10:26,7.72,17518
22970,JAM JAR WITH GREEN LID,55,12/1/2010 10:26,7.72,17518
22975,ROSE COTTAGE KEEPSAKE BOX ,15,12/1/2010 10:26,15.5,17518
84977S,HANGING HEART ZINC T-LIGHT HOLDER,151,12/1/2010 10:26,7.64,17518
22917,PAPER CHAIN KIT VINTAGE CHRISTMAS,47,12/1/2010 10:26,9.55,17518
20675,DISCO BALL CHRISTMAS DECORATION,295,12/1/2010 10:26,7.1,17518
85130A,WHITE HANGING HEART T-LIGHT HOLDER,71,12/1/2010 10:26,9.55,17518
22204,SMALL POPCORN HOLDER,107,12/1/2010 10:26,7.72,17518
22205,LARGE POPCORN HOLDER ,57,12/1/2010 10:26,8.45,17518
21540,RETROSPOT LARGE MILK JUG,19,12/1/2010 10:26,11.25,17518
21087,SET/20 RED RETROSPOT PAPER NAPKINS ,103,12/1/2010 10:26,7.64,17518
21101,SET/6 RED SPOTTY PAPER PLATES,103,12/1/2010 10:26,7.64,17518
21093,SET/6 RED SPOTTY PAPER CUPS,55,12/1/2010 10:26,7.65,17518
21793,POLKADOT RAIN HAT ,151,12/1/2010 10:26,7.32,17518
22661,DELUXE SEWING KIT ,47,12/1/2010 10:26,11.95,17518
21492,RETROSPOT HEART HOT WATER BOTTLE,31,12/1/2010 10:26,11.25,17518
84036G,KNITTED UNION FLAG HOT WATER BOTTLE,31,12/1/2010 10:26,10.39,17518
84037E,ENGLISH ROSE HOT WATER BOTTLE,31,12/1/2010 10:26,10.75,17518
22181,PHOTO CUBE,55,12/1/2010 10:26,8.48,17518
22976,HOMEMADE JAM SCENTED CANDLES,103,12/1/2010 10:26,8.25,17518
85106B,JUMBO BAG RED RETROSPOT,107,12/1/2010 10:26,8.65,17518
22563,PLASTERS IN TIN CIRCUS PARADE ,-5,12/1/2010 10:31,8.65,17555
21991,PACK OF 12 PINK PAISLEY TISSUES ,-17,12/1/2010 10:31,7.29,17555
21990,PACK OF 12 BLUE PAISLEY TISSUES ,-17,12/1/2010 10:31,7.29,17555
21987,PACK OF 12 RED RETROSPOT TISSUES ,-17,12/1/2010 10:31,7.29,17555
21491,CHICK GREY HOT WATER BOTTLE,-5,12/1/2010 10:31,10.45,17555
22564,PLASTERS IN TIN VINTAGE PAISLEY ,-5,12/1/2010 10:31,8.65,17555
22560,PLASTERS IN TIN SKULLS,-17,12/1/2010 10:31,8.65,17555
22157,10 STRIPEY MICE FELTCRAFT,13,12/1/2010 10:36,8.95,13712
22626,SET OF 6 SOLDIER SKITTLES,11,12/1/2010 10:36,10.75,13712
21898,TRADITIONAL WOODEN SKIPPING ROPE,19,12/1/2010 10:36,8.25,13712
21896,WOODEN BOX OF DOMINOES,19,12/1/2010 10:36,8.25,13712
22834,RUSTIC  SEVENTEEN DRAWER SIDEBOARD,8,12/1/2010 10:36,172,13712
22134,PARTY CONES CARNIVAL ASSORTED,19,12/1/2010 10:36,8.25,13712
22135,PARTY CONES CANDY ASSORTED,19,12/1/2010 10:36,8.25,13712
22509,PICNIC BASKET WICKER SMALL,11,12/1/2010 10:36,12.95,13712
84886,ASSORTED COLOUR BIRD ORNAMENT,23,12/1/2010 10:36,8.69,13712
22345,STAR DECORATION PAINTED ZINC ,31,12/1/2010 10:36,7.65,13712
22187,RETROSPOT LAMP,15,12/1/2010 10:44,16.95,13754
21513,"FANCY FONT BIRTHDAY CARD, ",31,12/1/2010 10:46,7.42,13415
22640,HAND WARMER UNION JACK,103,12/1/2010 10:46,8.85,13415
22873,HAND WARMER SCOTTY DOG DESIGN,103,12/1/2010 10:46,8.85,13415
22872,HAND WARMER OWL DESIGN,103,12/1/2010 10:46,8.85,13415
22639,HAND WARMER RED RETROSPOT,103,12/1/2010 10:46,8.85,13415
21492,RETROSPOT HEART HOT WATER BOTTLE,19,12/1/2010 10:46,11.95,13415
22356,DOG BOWL CHASING BALL DESIGN,19,12/1/2010 10:46,10.75,13415
22565,CLOTHES PEGS RETROSPOT PACK 24 ,55,12/1/2010 10:46,8.25,13415
85159,HAND OVER THE CHOCOLATE   SIGN ,19,12/1/2010 10:46,9.1,13415
85130A,WHITE HANGING HEART T-LIGHT HOLDER,39,12/1/2010 10:46,9.55,13415
22659,TRAVEL SEWING KIT,27,12/1/2010 10:46,8.65,13415
22195,BLACK HEART CARD HOLDER,15,12/1/2010 10:54,10.95,13774
84886,ASSORTED COLOUR BIRD ORNAMENT,39,12/1/2010 10:54,8.69,13774
21984,PACK OF 60 PINK PAISLEY CAKE CASES,31,12/1/2010 10:54,7.55,13774
84998,67 TEATIME FAIRY CAKE CASES,31,12/1/2010 10:54,7.55,13774
21219,PACK OF 72 RETROSPOT CAKE CASES,31,12/1/2010 10:54,7.55,13774
21491,CHICK GREY HOT WATER BOTTLE,15,12/1/2010 10:54,10.45,13774
21321,SMALL GLASS HEART TRINKET POT,15,12/1/2010 10:54,9.1,13774
22737,ALARM CLOCK BAKELIKE IVORY,11,12/1/2010 10:54,10.75,13774
22734,ALARM CLOCK BAKELIKE RED ,15,12/1/2010 10:54,10.75,13774
22736,ALARM CLOCK BAKELIKE ORANGE,15,12/1/2010 10:54,10.75,13774
22733,ALARM CLOCK BAKELIKE GREEN,15,12/1/2010 10:54,10.75,13774
22121,HOT WATER BOTTLE TEA AND SYMPATHY,15,12/1/2010 10:54,10.95,13774
22874,HAND WARMER BIRD DESIGN,55,12/1/2010 10:54,9.1,13774
22873,HAND WARMER SCOTTY DOG DESIGN,55,12/1/2010 10:54,9.1,13774
85130A,WHITE HANGING HEART T-LIGHT HOLDER,13,12/1/2010 10:58,9.55,17857
71060,WHITE METAL LANTERN,13,12/1/2010 10:58,10.39,17857
84413B,CREAM CUPID HEARTS COAT HANGER,15,12/1/2010 10:58,9.75,17857
15063BL,EDWARDIAN PARASOL BLACK,13,12/1/2010 10:58,11.95,17857
20686,EDWARDIAN PARASOL RED,13,12/1/2010 10:58,11.95,17857
37377,RETRO COFFEE MUGS ASSORTED,13,12/1/2010 10:58,8.06,17857
21878,SAVE THE PLANET MUG,13,12/1/2010 10:58,8.06,17857
21078,VINTAGE BILLBOARD DRINK ME MUG,13,12/1/2010 10:58,8.06,17857
21075,VINTAGE BILLBOARD LOVE/HATE MUG,13,12/1/2010 10:58,8.06,17857
82490,WOOD 2 DRAWER CABINET WHITE FINISH,9,12/1/2010 10:58,11.95,17857
82493,WOOD S/3 CABINET ANT WHITE FINISH,11,12/1/2010 10:58,13.95,17857
82489,WOODEN PICTURE FRAME WHITE FINISH,13,12/1/2010 10:58,9.1,17857
82501L,WOODEN FRAME ANTIQUE WHITE ,19,12/1/2010 10:58,9.55,17857
84036G,KNITTED UNION FLAG HOT WATER BOTTLE,13,12/1/2010 10:58,10.39,17857
84036E,RED WOOLLY HOTTIE WHITE HEART.,13,12/1/2010 10:58,10.39,17857
22759,SET 7 BABUSHKA NESTING BOXES,9,12/1/2010 10:58,14.65,17857
22810,IVORY EMBROIDERED QUILT ,9,12/1/2010 10:58,42.75,17857
21737,GLASS STAR FROSTED T-LIGHT HOLDER,13,12/1/2010 10:58,11.25,17857
35011B,SET OF 3 BLACK FLYING DUCKS,19,12/1/2010 10:58,11.65,17931
35011C,SET OF 3 COLOURED  FLYING DUCKS,55,12/1/2010 10:58,11.65,17931
21987,PACK OF 12 RED RETROSPOT TISSUES ,31,12/1/2010 10:59,7.29,13455
21851,RED RETROSPOT MUG,13,12/1/2010 10:59,9.95,13455
22475,BABUSHKA LIGHTS STRING OF 17,11,12/1/2010 10:59,13.75,13455
22644,PIGGY BANK RETROSPOT ,15,12/1/2010 10:59,9.55,13455
22759,SET 7 BABUSHKA NESTING BOXES,13,12/1/2010 10:59,15.5,13455
48192,DOORMAT FAIRY CAKE,9,12/1/2010 10:59,14.95,13455
22639,HAND WARMER RED RETROSPOT,19,12/1/2010 10:59,9.1,13455
22873,HAND WARMER SCOTTY DOG DESIGN,19,12/1/2010 10:59,9.1,13455
22872,HAND WARMER OWL DESIGN,19,12/1/2010 10:59,9.1,13455
21239,STRAWBERRY CERAMIC TRINKET BOX,19,12/1/2010 10:59,8.25,13455
22071,PINK DOUGHNUT TRINKET POT ,19,12/1/2010 10:59,8.65,13455
22456,SILK PURSE BABUSHKA PINK,13,12/1/2010 10:59,10.35,13455
22121,HOT WATER BOTTLE TEA AND SYMPATHY,11,12/1/2010 10:59,10.95,13455
22842,HOT WATER BOTTLE I AM SO POORLY,15,12/1/2010 10:59,11.65,13455
22119,CHOCOLATE HOT WATER BOTTLE,16,12/1/2010 10:59,11.95,13455
21486,WHITE SKULL HOT WATER BOTTLE ,11,12/1/2010 10:59,10.75,13455
22118,SCOTTIE DOG HOT WATER BOTTLE,16,12/1/2010 10:59,11.95,13455
22639,HAND WARMER RED POLKA DOT,13,12/1/2010 10:59,8.85,17857
22640,HAND WARMER UNION JACK,13,12/1/2010 10:59,8.85,17857
22976,HOMEMADE JAM SCENTED CANDLES,19,12/1/2010 10:60,8.45,13455
22117,BIRD HOUSE HOT WATER BOTTLE,8,12/1/2010 11:28,9.55,15869
22105,BOUDOIR SQUARE TISSUE BOX,8,12/1/2010 11:28,8.25,15869
22107,SKULLS SQUARE TISSUE BOX,9,12/1/2010 11:28,8.25,15869
22773,PHOTO FRAME CORNICE,8,12/1/2010 11:28,9.95,15869
22458,SILK PURSE BABUSHKA RED,8,12/1/2010 11:28,10.35,15869
22556,PICTURE DOMINOES,8,12/1/2010 11:28,8.45,15869
84751,S/6 SEW ON CROCHET FLOWERS,8,12/1/2010 11:28,8.25,15869
85056E,SCANDINAVIAN REDS RIBBONS,9,12/1/2010 11:28,8.25,15869
21335,BALLOONS  WRITING SET ,8,12/1/2010 11:28,8.65,15869
22968,JAM MAKING SET PRINTED,11,12/1/2010 11:28,8.45,15869
17098A,LAVENDER INCENSE IN TIN,8,12/1/2010 11:28,8.25,15869
22480,TV DINNER TRAY VINTAGE PAISLEY,8,12/1/2010 11:28,11.95,15869
84516A,SET OF 4 ENGLISH ROSE PLACEMATS,9,12/1/2010 11:28,10.75,15869
84517A,SET OF 4 ENGLISH ROSE COASTERS,9,12/1/2010 11:28,8.25,15869
22774,TRIPLE PHOTO FRAME CORNICE ,9,12/1/2010 11:28,16.95,15869
22775,FAMILY PHOTO FRAME CORNICE,8,12/1/2010 11:28,16.95,15869
21470,MIRRORED DISCO BALL ,8,12/1/2010 11:28,12.95,15869
21471,DISCO BALL ROTATOR BATTERY OPERATED,8,12/1/2010 11:28,11.25,15869
20827,SILVER LOOKING MIRROR,10,12/1/2010 11:28,11.95,15869
85157,LADIES & GENTLEMEN METAL SIGN,8,12/1/2010 11:28,9.55,15869
22124,METAL SIGN HER DINNER IS SERVED ,8,12/1/2010 11:28,9.95,15869
21176,YOU'RE CONFUSING ME METAL SIGN ,9,12/1/2010 11:28,8.69,15869
48136,DOORMAT TOPIARY,8,12/1/2010 11:28,14.95,15869
82587,BATHROOM METAL SIGN,8,12/1/2010 11:28,7.55,15869
82585,KITCHEN METAL SIGN,8,12/1/2010 11:28,7.55,15869
82588,TOILET METAL SIGN,9,12/1/2010 11:28,7.55,15869
22420,METAL SIGN TAKE IT OR LEAVE IT ,11,12/1/2010 11:28,9.95,15869
StockCode,Description,Quantity,InvoiceDate,UnitPrice,CustomerID
85131A,WHITE HANGING HEART T-LIGHT HOLDER,14,12/1/2010 8:34,10.55,17858
71061,WHITE METAL LANTERN,14,12/1/2010 8:34,11.39,17858
84414B,CREAM CUPID HEARTS COAT HANGER,16,12/1/2010 8:34,10.75,17858
84037G,KNITTED UNION FLAG HOT WATER BOTTLE,14,12/1/2010 8:34,11.39,17858
84037E,RED WOOLLY HOTTIE WHITE HEART.,14,12/1/2010 8:34,11.39,17858
22760,SET 7 BABUSHKA NESTING BOXES,10,12/1/2010 8:34,15.65,17858
21738,GLASS STAR FROSTED T-LIGHT HOLDER,14,12/1/2010 8:34,12.25,17858
22641,HAND WARMER UNION JACK,14,12/1/2010 8:36,9.85,17858
22640,HAND WARMER RED POLKA DOT,14,12/1/2010 8:36,9.85,17858
84887,ASSORTED COLOUR BIRD ORNAMENT,40,12/1/2010 8:42,9.69,13055
22753,POPPY'S PLAYHOUSE BEDROOM ,14,12/1/2010 8:42,10.1,13055
22756,POPPY'S PLAYHOUSE KITCHEN,14,12/1/2010 8:42,10.1,13055
22757,FELTCRAFT PRINCESS CHARLOTTE DOLL,16,12/1/2010 8:42,11.75,13055
22318,IVORY KNITTED MUG COSY ,14,12/1/2010 8:42,9.65,13055
84977,BOX OF 6 ASSORTED COLOUR TEASPOONS,14,12/1/2010 8:42,12.25,13055
22631,BOX OF VINTAGE JIGSAW BLOCKS ,11,12/1/2010 8:42,12.95,13055
22630,BOX OF VINTAGE ALPHABET BLOCKS,10,12/1/2010 8:42,17.95,13055
21762,HOME BUILDING BLOCK WORD,11,12/1/2010 8:42,13.95,13055
21763,LOVE BUILDING BLOCK WORD,11,12/1/2010 8:42,13.95,13055
21785,RECIPE BOX WITH METAL HEART,12,12/1/2010 8:42,15.95,13055
48195,DOORMAT NEW ENGLAND,12,12/1/2010 8:42,15.95,13055
22968,JAM MAKING SET WITH JARS,14,12/1/2010 8:42,12.25,13055
22921,RED COAT RACK PARIS FASHION,11,12/1/2010 8:42,12.95,13055
22920,YELLOW COAT RACK PARIS FASHION,11,12/1/2010 8:42,12.95,13055
22922,BLUE COAT RACK PARIS FASHION,11,12/1/2010 8:42,12.95,13055
21764,BATH BUILDING BLOCK WORD,11,12/1/2010 8:43,13.95,13055
22736,ALARM CLOCK BAKELIKE PINK,32,12/1/2010 8:53,11.75,12591
22735,ALARM CLOCK BAKELIKE RED ,32,12/1/2010 8:53,11.75,12591
22734,ALARM CLOCK BAKELIKE GREEN,20,12/1/2010 8:53,11.75,12591
21732,PANDA AND BUNNIES STICKER SHEET,20,12/1/2010 8:53,8.85,12591
21891,STARS GIFT TAPE ,32,12/1/2010 8:53,8.65,12591
10010,INFLATABLE POLITICAL GLOBE ,56,12/1/2010 8:53,8.85,12591
21799,VINTAGE HEADS AND TAILS CARD GAME ,32,12/1/2010 8:53,9.25,12591
21043,SET/2 RED RETROSPOT TEA TOWELS ,26,12/1/2010 8:53,10.95,12591
22334,ROUND SNACK BOXES SET OF4 WOODLAND ,32,12/1/2010 8:53,10.95,12591
22637,SPACEBOY LUNCH BOX ,32,12/1/2010 8:53,9.95,12591
22667,LUNCH BOX I LOVE LONDON,32,12/1/2010 8:53,9.95,12591
22639,CIRCUS PARADE LUNCH BOX ,32,12/1/2010 8:53,9.95,12591
22669,CHARLOTTE BAG DOLLY GIRL DESIGN,28,12/1/2010 8:53,8.85,12591
21739,RED TOADSTOOL LED NIGHT LIGHT,32,12/1/2010 8:53,9.65,12591
22908, SET 2 TEA TOWELS I LOVE LONDON ,32,12/1/2010 8:53,10.95,12591
21921,VINTAGE SEASIDE JIGSAW PUZZLES,20,12/1/2010 8:53,11.75,12591
22548,MINI JIGSAW CIRCUS PARADE ,32,12/1/2010 8:53,8.42,12591
22552,MINI JIGSAW SPACEBOY,32,12/1/2010 8:53,8.42,12591
22500,MINI PAINT SET VINTAGE ,44,12/1/2010 8:53,8.65,12591
POST,POSTAGE,11,12/1/2010 8:53,26,12591
22094,PAPER CHAIN KIT 50'S CHRISTMAS ,88,12/1/2010 9:08,10.55,13756
22640,HAND WARMER RED POLKA DOT,14,12/1/2010 9:09,9.85,17858
22641,HAND WARMER UNION JACK,14,12/1/2010 9:09,9.85,17858
85131A,WHITE HANGING HEART T-LIGHT HOLDER,14,12/1/2010 9:10,10.55,17858
71061,WHITE METAL LANTERN,14,12/1/2010 9:10,11.39,17858
84414B,CREAM CUPID HEARTS COAT HANGER,16,12/1/2010 9:10,10.75,17858
20687,EDWARDIAN PARASOL RED,14,12/1/2010 9:10,12.95,17858
37378,RETRO COFFEE MUGS ASSORTED,14,12/1/2010 9:10,9.06,17858
21879,SAVE THE PLANET MUG,14,12/1/2010 9:10,9.06,17858
21079,VINTAGE BILLBOARD DRINK ME MUG,14,12/1/2010 9:10,9.06,17858
21076,VINTAGE BILLBOARD LOVE/HATE MUG,14,12/1/2010 9:10,9.06,17858
82491,WOOD 2 DRAWER CABINET WHITE FINISH,10,12/1/2010 9:10,12.95,17858
82494,WOOD S/3 CABINET ANT WHITE FINISH,12,12/1/2010 9:10,14.95,17858
82490,WOODEN PICTURE FRAME WHITE FINISH,14,12/1/2010 9:10,10.1,17858
82502L,WOODEN FRAME ANTIQUE WHITE ,14,12/1/2010 9:10,10.55,17858
84037G,KNITTED UNION FLAG HOT WATER BOTTLE,14,12/1/2010 9:10,11.39,17858
84037E,RED WOOLLY HOTTIE WHITE HEART.,14,12/1/2010 9:10,11.39,17858
22760,SET 7 BABUSHKA NESTING BOXES,10,12/1/2010 9:10,15.65,17858
21738,GLASS STAR FROSTED T-LIGHT HOLDER,14,12/1/2010 9:10,12.25,17858
21266,VICTORIAN SEWING BOX LARGE,40,12/1/2010 9:17,18.95,15108
85131A,WHITE HANGING HEART T-LIGHT HOLDER,14,12/1/2010 9:40,10.55,17858
71061,WHITE METAL LANTERN,14,12/1/2010 9:40,11.39,17858
84414B,CREAM CUPID HEARTS COAT HANGER,16,12/1/2010 9:40,10.75,17858
20687,EDWARDIAN PARASOL RED,14,12/1/2010 9:40,12.95,17858
37378,RETRO COFFEE MUGS ASSORTED,14,12/1/2010 9:40,9.06,17858
21879,SAVE THE PLANET MUG,14,12/1/2010 9:40,9.06,17858
21079,VINTAGE BILLBOARD DRINK ME MUG,14,12/1/2010 9:40,9.06,17858
21076,VINTAGE BILLBOARD LOVE/HATE MUG,14,12/1/2010 9:40,9.06,17858
82491,WOOD 2 DRAWER CABINET WHITE FINISH,10,12/1/2010 9:40,12.95,17858
82494,WOOD S/3 CABINET ANT WHITE FINISH,12,12/1/2010 9:40,14.95,17858
82490,WOODEN PICTURE FRAME WHITE FINISH,14,12/1/2010 9:40,10.1,17858
82502L,WOODEN FRAME ANTIQUE WHITE ,14,12/1/2010 9:40,10.55,17858
84037G,KNITTED UNION FLAG HOT WATER BOTTLE,14,12/1/2010 9:40,11.39,17858
84037E,RED WOOLLY HOTTIE WHITE HEART.,14,12/1/2010 9:40,11.39,17858
22760,SET 7 BABUSHKA NESTING BOXES,10,12/1/2010 9:40,15.65,17858
21738,GLASS STAR FROSTED T-LIGHT HOLDER,14,12/1/2010 9:40,12.25,17858
22122,HOT WATER BOTTLE TEA AND SYMPATHY,56,12/1/2010 9:40,11.45,15299
21741,RED HANGING HEART T-LIGHT HOLDER,72,12/1/2010 9:40,10.55,15299
22640,HAND WARMER RED POLKA DOT,14,12/1/2010 9:42,9.85,17858
22641,HAND WARMER UNION JACK,14,12/1/2010 9:42,9.85,17858
22394,JUMBO BAG PINK POLKADOT,18,12/1/2010 9:45,9.95,14696
85107C,JUMBO  BAG BAROQUE BLACK WHITE,18,12/1/2010 9:45,9.95,14696
21041,JUMBO BAG CHARLIE AND LOLA TOYS,18,12/1/2010 9:45,10.95,14696
20731,STRAWBERRY CHARLOTTE BAG,18,12/1/2010 9:45,8.85,14696
85005B,RED 3 PIECE RETROSPOT CUTLERY SET,20,12/1/2010 9:45,11.75,14696
85005C,BLUE 3 PIECE POLKADOT CUTLERY SET,14,12/1/2010 9:45,11.75,14696
21102,SET/6 RED SPOTTY PAPER PLATES,20,12/1/2010 9:45,8.85,14696
20733,LUNCH BAG RED RETROSPOT,18,12/1/2010 9:45,9.65,14696
21567,STRAWBERRY LUNCH BOX WITH CUTLERY,14,12/1/2010 9:45,10.55,14696
22360,LUNCH BOX WITH CUTLERY RETROSPOT ,14,12/1/2010 9:45,10.55,14696
21220,PACK OF 72 RETROSPOT CAKE CASES,128,12/1/2010 9:45,8.42,14696
