StockCode,Description,Quantity,InvoiceDate,UnitPrice,CustomerID
21776,LOVE BUILDING BLOCK WORD,24,12/1/2010 8:55,26.95,13068
21798,RECIPE BOX WITH METAL HEART,25,12/1/2010 8:55,28.95,13068
48208,DOORMAT NEW ENGLAND,25,12/1/2010 8:55,28.95,13068
22981,JAM MAKING SET WITH JARS,27,12/1/2010 8:55,25.25,13068
22934,RED COAT RACK PARIS FASHION,24,12/1/2010 8:55,25.95,13068
22933,YELLOW COAT RACK PARIS FASHION,24,12/1/2010 8:55,25.95,13068
22935,BLUE COAT RACK PARIS FASHION,24,12/1/2010 8:55,25.95,13068
21777,BATH BUILDING BLOCK WORD,24,12/1/2010 8:56,26.95,13068
22749,ALARM CLOCK BAKELIKE PINK,45,12/1/2010 8:66,24.75,12604
22748,ALARM CLOCK BAKELIKE RED ,45,12/1/2010 8:66,24.75,12604
22747,ALARM CLOCK BAKELIKE GREEN,33,12/1/2010 8:66,24.75,12604
21745,PANDA AND BUNNIES STICKER SHEET,33,12/1/2010 8:66,21.85,12604
21904,STARS GIFT TAPE ,45,12/1/2010 8:66,21.65,12604
10023,INFLATABLE POLITICAL GLOBE ,69,12/1/2010 8:66,21.85,12604
21812,VINTAGE HEADS AND TAILS CARD GAME ,45,12/1/2010 8:66,22.25,12604
21056,SET/2 RED RETROSPOT TEA TOWELS ,39,12/1/2010 8:66,23.95,12604
22347,ROUND SNACK BOXES SET OF4 WOODLAND ,45,12/1/2010 8:66,23.95,12604
22650,SPACEBOY LUNCH BOX ,45,12/1/2010 8:66,22.95,12604
22680,LUNCH BOX I LOVE LONDON,45,12/1/2010 8:66,22.95,12604
22652,CIRCUS PARADE LUNCH BOX ,45,12/1/2010 8:66,22.95,12604
22682,CHARLOTTE BAG DOLLY GIRL DESIGN,41,12/1/2010 8:66,21.85,12604
21752,RED TOADSTOOL LED NIGHT LIGHT,45,12/1/2010 8:66,22.65,12604
22921, SET 2 TEA TOWELS I LOVE LONDON ,45,12/1/2010 8:66,23.95,12604
21934,VINTAGE SEASIDE JIGSAW PUZZLES,33,12/1/2010 8:66,24.75,12604
22561,MINI JIGSAW CIRCUS PARADE ,45,12/1/2010 8:66,21.42,12604
22565,MINI JIGSAW SPACEBOY,45,12/1/2010 8:66,21.42,12604
22513,MINI PAINT SET VINTAGE ,57,12/1/2010 8:66,21.65,12604
POST,POSTAGE,24,12/1/2010 8:66,39,12604
22107,PAPER CHAIN KIT 50'S CHRISTMAS ,101,12/1/2010 9:21,23.55,13769
22653,HAND WARMER RED POLKA DOT,27,12/1/2010 9:22,22.85,17871
22654,HAND WARMER UNION JACK,27,12/1/2010 9:22,22.85,17871
85144A,WHITE HANGING HEART T-LIGHT HOLDER,27,12/1/2010 9:23,23.55,17871
71074,WHITE METAL LANTERN,27,12/1/2010 9:23,24.39,17871
84427B,CREAM CUPID HEARTS COAT HANGER,29,12/1/2010 9:23,23.75,17871
20700,EDWARDIAN PARASOL RED,27,12/1/2010 9:23,25.95,17871
37391,RETRO COFFEE MUGS ASSORTED,27,12/1/2010 9:23,22.06,17871
21892,SAVE THE PLANET MUG,27,12/1/2010 9:23,22.06,17871
21092,VINTAGE BILLBOARD DRINK ME MUG,27,12/1/2010 9:23,22.06,17871
21089,VINTAGE BILLBOARD LOVE/HATE MUG,27,12/1/2010 9:23,22.06,17871
82504,WOOD 2 DRAWER CABINET WHITE FINISH,23,12/1/2010 9:23,25.95,17871
82507,WOOD S/3 CABINET ANT WHITE FINISH,25,12/1/2010 9:23,27.95,17871
82503,WOODEN PICTURE FRAME WHITE FINISH,27,12/1/2010 9:23,23.1,17871
82515L,WOODEN FRAME ANTIQUE WHITE ,27,12/1/2010 9:23,23.55,17871
84050G,KNITTED UNION FLAG HOT WATER BOTTLE,27,12/1/2010 9:23,24.39,17871
84050E,RED WOOLLY HOTTIE WHITE HEART.,27,12/1/2010 9:23,24.39,17871
22773,SET 7 BABUSHKA NESTING BOXES,23,12/1/2010 9:23,28.65,17871
21751,GLASS STAR FROSTED T-LIGHT HOLDER,27,12/1/2010 9:23,25.25,17871
21279,VICTORIAN SEWING BOX LARGE,53,12/1/2010 9:30,31.95,15121
85144A,WHITE HANGING HEART T-LIGHT HOLDER,27,12/1/2010 9:53,23.55,17871
71074,WHITE METAL LANTERN,27,12/1/2010 9:53,24.39,17871
84427B,CREAM CUPID HEARTS COAT HANGER,29,12/1/2010 9:53,23.75,17871
20700,EDWARDIAN PARASOL RED,27,12/1/2010 9:53,25.95,17871
37391,RETRO COFFEE MUGS ASSORTED,27,12/1/2010 9:53,22.06,17871
21892,SAVE THE PLANET MUG,27,12/1/2010 9:53,22.06,17871
21092,VINTAGE BILLBOARD DRINK ME MUG,27,12/1/2010 9:53,22.06,17871
21089,VINTAGE BILLBOARD LOVE/HATE MUG,27,12/1/2010 9:53,22.06,17871
82504,WOOD 2 DRAWER CABINET WHITE FINISH,23,12/1/2010 9:53,25.95,17871
82507,WOOD S/3 CABINET ANT WHITE FINISH,25,12/1/2010 9:53,27.95,17871
82503,WOODEN PICTURE FRAME WHITE FINISH,27,12/1/2010 9:53,23.1,17871
82515L,WOODEN FRAME ANTIQUE WHITE ,27,12/1/2010 9:53,23.55,17871
84050G,KNITTED UNION FLAG HOT WATER BOTTLE,27,12/1/2010 9:53,24.39,17871
84050E,RED WOOLLY HOTTIE WHITE HEART.,27,12/1/2010 9:53,24.39,17871
22773,SET 7 BABUSHKA NESTING BOXES,23,12/1/2010 9:53,28.65,17871
21751,GLASS STAR FROSTED T-LIGHT HOLDER,27,12/1/2010 9:53,25.25,17871
22135,HOT WATER BOTTLE TEA AND SYMPATHY,69,12/1/2010 9:53,24.45,15312
21754,RED HANGING HEART T-LIGHT HOLDER,85,12/1/2010 9:53,23.55,15312
22653,HAND WARMER RED POLKA DOT,27,12/1/2010 9:55,22.85,17871
22654,HAND WARMER UNION JACK,27,12/1/2010 9:55,22.85,17871
22407,JUMBO BAG PINK POLKADOT,31,12/1/2010 9:58,22.95,14709
85120C,JUMBO  BAG BAROQUE BLACK WHITE,31,12/1/2010 9:58,22.95,14709
21054,JUMBO BAG CHARLIE AND LOLA TOYS,31,12/1/2010 9:58,23.95,14709
20744,STRAWBERRY CHARLOTTE BAG,31,12/1/2010 9:58,21.85,14709
85018B,RED 3 PIECE RETROSPOT CUTLERY SET,33,12/1/2010 9:58,24.75,14709
85018C,BLUE 3 PIECE POLKADOT CUTLERY SET,27,12/1/2010 9:58,24.75,14709
21115,SET/6 RED SPOTTY PAPER PLATES,33,12/1/2010 9:58,21.85,14709
20746,LUNCH BAG RED RETROSPOT,31,12/1/2010 9:58,22.65,14709
21580,STRAWBERRY LUNCH BOX WITH CUTLERY,27,12/1/2010 9:58,23.55,14709
22373,LUNCH BOX WITH CUTLERY RETROSPOT ,27,12/1/2010 9:58,23.55,14709
21233,PACK OF 72 RETROSPOT CAKE CASES,141,12/1/2010 9:58,21.42,14709
21996,PACK OF 60 DINOSAUR CAKE CASES,45,12/1/2010 9:58,21.55,14709
21998,PACK OF 60 PINK PAISLEY CAKE CASES,45,12/1/2010 9:58,21.55,14709
85012,81 TEATIME FAIRY CAKE CASES,45,12/1/2010 9:58,21.55,14709
84540A,TOMATO CHARLIE+LOLA COASTER SET,27,12/1/2010 9:58,23.95,14709
85204B,CHARLIE & LOLA WASTEPAPER BIN FLORA,69,12/1/2010 9:58,22.25,14709
85092B,RED CHARLIE+LOLA PERSONAL DOORSIGN,117,12/1/2010 9:58,21.38,14709
21952,JUMBO STORAGE BAG SUKI,31,12/1/2010 9:58,22.95,14709
21950,JUMBO BAG PINK VINTAGE PAISLEY,31,12/1/2010 9:58,22.95,14709
22982,JAM MAKING SET PRINTED,45,12/1/2010 9:62,22.45,17830
22160,RETROSPOT TEA SET CERAMIC 11 PC ,44,12/1/2010 9:62,25.25,15332
84875,GIRLY PINK TOOL SET,26,12/1/2010 9:62,25.95,15332
22432,JUMBO SHOPPER VINTAGE RED PAISLEY,31,12/1/2010 9:62,22.95,15332
82588,"AIRLINE LOUNGE,METAL SIGN",23,12/1/2010 9:62,23.1,15332
21693,WHITE SPOT RED CERAMIC DRAWER KNOB,27,12/1/2010 9:62,22.25,15332
22795,RED DRAWER KNOB ACRYLIC EDWARDIAN,45,12/1/2010 9:62,22.25,15332
22792,CLEAR DRAWER KNOB ACRYLIC EDWARDIAN,45,12/1/2010 9:62,22.25,15332
71291,PHOTO CLIP LINE,22,12/1/2010 9:62,22.25,15332
22283,FELT EGG COSY CHICKEN,22,12/1/2010 9:62,21.85,15332
22658,PIGGY BANK RETROSPOT ,22,12/1/2010 9:62,23.55,15332
21955,SKULL SHOULDER BAG,31,12/1/2010 9:62,22.65,15332
21190,YOU'RE CONFUSING ME METAL SIGN ,24,12/1/2010 9:62,22.69,15332
21187,COOK WITH WINE METAL SIGN ,22,12/1/2010 9:62,22.95,15332
21196,GIN + TONIC DIET METAL SIGN,23,12/1/2010 9:62,23.1,15332
37465A,YELLOW BREAKFAST CUP AND SAUCER,22,12/1/2010 9:62,23.95,15332
37465C,PINK BREAKFAST CUP AND SAUCER ,22,12/1/2010 9:62,23.95,15332
22107,PAPER CHAIN KIT 50'S CHRISTMAS ,25,12/1/2010 9:62,23.95,15332
22104,PAPER CHAIN KIT RETROSPOT,22,12/1/2010 9:62,23.95,15332
84992S,SMALL HEART FLOWERS HOOK ,27,12/1/2010 9:62,21.85,15332
71291,PHOTO CLIP LINE,24,12/1/2010 9:62,22.25,15332
47601,TEA TIME DES TEA COSY,23,12/1/2010 9:62,23.55,15332
22282,FELT EGG COSY WHITE RABBIT ,22,12/1/2010 9:62,21.85,15332
84853,ZINC WILLIE WINKIE  CANDLE STICK,22,12/1/2010 9:62,21.85,15332
22665,CERAMIC CHERRY CAKE MONEY BANK,22,12/1/2010 9:62,22.45,15332
21554,RETROSPOT LARGE MILK JUG,22,12/1/2010 9:62,25.95,15332
21578,SET OF 6 FUNKY BEAKERS,23,12/1/2010 9:62,23.95,15332
15077BL,EDWARDIAN PARASOL BLACK,23,12/1/2010 9:62,26.95,15332
15077N,EDWARDIAN PARASOL NATURAL,23,12/1/2010 9:62,26.95,15332
22667,CERAMIC STRAWBERRY CAKE MONEY BANK,25,12/1/2010 9:62,22.45,15332
22197,BLUE OWL SOFT TOY,22,12/1/2010 9:62,23.95,15332
22459,BALLOON ART MAKE YOUR OWN FLOWERS,22,12/1/2010 9:62,22.95,15332
21752,RED TOADSTOOL LED NIGHT LIGHT,23,12/1/2010 9:62,22.65,15332
22799,GLASS CLOCHE SMALL,24,12/1/2010 9:62,24.95,15332
22740,GUMBALL MONOCHROME COAT RACK,57,12/1/2010 9:62,22.06,15332
21544,DOORMAT FANCY FONT HOME SWEET HOME,31,12/1/2010 9:62,27.75,15332
D,Discount,20,12/1/2010 9:62,48.5,14548
10023,INFLATABLE POLITICAL GLOBE ,33,12/1/2010 9:66,21.85,16119
21933,VINTAGE SNAKES & LADDERS,29,12/1/2010 9:66,24.75,16119
21853,CHOCOLATE CALCULATOR,33,12/1/2010 9:66,22.65,16119
22432,JUMBO SHOPPER VINTAGE RED PAISLEY,31,12/1/2010 9:66,22.95,16119
22400,RECYCLING BAG RETROSPOT ,31,12/1/2010 9:66,23.1,16119
22402,TOY TIDY PINK POLKADOT,71,12/1/2010 9:66,22.85,16119
22819,ANTIQUE GLASS DRESSING TABLE POT,29,12/1/2010 9:66,23.95,16119
22747,ALARM CLOCK BAKELIKE GREEN,25,12/1/2010 9:66,24.75,16119
22947,IVORY GIANT GARDEN THERMOMETER,33,12/1/2010 9:66,26.95,16119
22860,24 TIER CAKE TIN GREEN AND CREAM,23,12/1/2010 9:66,35.95,16119
22859,24 TIER CAKE TIN RED AND CREAM,23,12/1/2010 9:66,35.95,16119
22804,SET 3 WICKER OVAL BASKETS W LIDS,25,12/1/2010 9:66,37.95,16119
35025C,SET OF 3 COLOURED  FLYING DUCKS,20,12/1/2010 9:70,25.65,15332
82505,WOOD BLACK BOARD ANT WHITE FINISH,24,12/1/2010 9:74,27.45,18095
84776,COLOUR GLASS T-LIGHT HOLDER HANGING,69,12/1/2010 9:74,21.65,18095
22485,HANGING METAL HEART LANTERN,33,12/1/2010 9:74,22.65,18095
21345,HANGING MEDINA LANTERN SMALL,27,12/1/2010 9:74,23.95,18095
22478,NATURAL SLATE HEART CHALKBOARD ,33,12/1/2010 9:74,23.95,18095
22490,HEART OF WICKER SMALL,61,12/1/2010 9:74,22.45,18095
22491,HEART OF WICKER LARGE,61,12/1/2010 9:74,23.55,18095
22245,WHITE LOVEBIRD LANTERN,27,12/1/2010 9:74,23.95,18095
21361,CLASSIC METAL BIRDCAGE PLANT HOLDER,23,12/1/2010 9:74,33.75,18095
22210,CREAM HEART CARD HOLDER,25,12/1/2010 9:74,24.95,18095
22448,ENAMEL FLOWER JUG CREAM,24,12/1/2010 9:74,26.95,18095
22449,ENAMEL FIRE BUCKET CREAM,27,12/1/2010 9:74,27.95,18095
22445,ENAMEL BREAD BIN CREAM,29,12/1/2010 9:74,31.95,18095
22804,SET 3 WICKER OVAL BASKETS W LIDS,22,12/1/2010 9:77,40.95,17441
22982,JAM MAKING SET PRINTED,33,12/1/2010 9:77,22.45,17441
22981,JAM MAKING SET WITH JARS,27,12/1/2010 9:77,25.25,17441
22684,JUMBO BAG DOLLY GIRL DESIGN,31,12/1/2010 9:77,22.95,17441
85070A,TRADITIONAL CHRISTMAS RIBBONS,33,12/1/2010 9:77,22.25,17441
22189,ORGANISER WOOD ANTIQUE WHITE ,23,12/1/2010 9:77,29.5,17441
22683,LUNCH BAG DOLLY GIRL DESIGN,31,12/1/2010 9:77,22.65,17441
84901,WHITE WIRE EGG HOLDER,57,12/1/2010 9:78,25.95,16050
85120C,JUMBO  BAG BAROQUE BLACK WHITE,121,12/1/2010 9:78,22.65,16050
85120B,JUMBO BAG RED RETROSPOT,121,12/1/2010 9:78,22.65,16050
79342,CHILLI LIGHTS,213,12/1/2010 9:79,24.82,16050
22801,LIGHT GARLAND BUTTERFILES PINK,213,12/1/2010 9:79,24.37,16050
22800,WOODEN OWLS LIGHT GARLAND ,213,12/1/2010 9:79,24.37,16050
22487,FAIRY TALE COTTAGE NIGHTLIGHT,453,12/1/2010 9:79,22.45,16050
21752,RED TOADSTOOL LED NIGHT LIGHT,453,12/1/2010 9:79,22.25,16050
21775,HOME BUILDING BLOCK WORD,24,12/1/2010 9:80,26.95,16271
21776,LOVE BUILDING BLOCK WORD,24,12/1/2010 9:80,26.95,16271
21544,DOORMAT FANCY FONT HOME SWEET HOME,23,12/1/2010 9:80,28.95,16271
21384,HOME SMALL WOOD LETTERS,24,12/1/2010 9:80,25.95,16271
21432,GINGHAM HEART  DOORSTOP RED,24,12/1/2010 9:80,25.25,16271
22339,FIVE HEART HANGING DECORATION,27,12/1/2010 9:80,23.95,16271
22485,HANGING METAL HEART LANTERN,33,12/1/2010 9:80,22.65,16271
22936,ASSORTED BOTTLE TOP  MAGNETS ,33,12/1/2010 9:80,21.42,16271
22943,FRIDGE MAGNETS US DINER ASSORTED,33,12/1/2010 9:80,21.85,16271
22990,HOMEMADE JAM SCENTED CANDLES,33,12/1/2010 9:80,22.45,16271
22944,FRIDGE MAGNETS LES ENFANTS ASSORTED,33,12/1/2010 9:80,21.85,16271
21136,ROSE CARAVAN DOORSTOP,25,12/1/2010 9:80,27.75,16271
22490,HEART OF WICKER SMALL,33,12/1/2010 9:80,22.65,16271
22263,26 HOOK HANGER MAGIC TOADSTOOL,33,12/1/2010 9:80,22.65,16271
22962,CHRISTMAS LIGHTS 10 REINDEER,27,12/1/2010 10:24,29.5,12452
21643,VINTAGE UNION JACK CUSHION COVER,29,12/1/2010 10:24,25.95,12452
21812,VINTAGE HEADS AND TAILS CARD GAME ,33,12/1/2010 10:24,22.25,12452
35025C,SET OF 3 COLOURED  FLYING DUCKS,27,12/1/2010 10:24,26.45,12452
35025G,SET OF 3 GOLD FLYING DUCKS,25,12/1/2010 10:24,27.35,12452
85035B,RED RETROSPOT UMBRELLA,27,12/1/2010 10:24,26.95,12452
85035A,BLACK/BLUE POLKADOT UMBRELLA,24,12/1/2010 10:24,26.95,12452
22214,RED DINER WALL CLOCK,23,12/1/2010 10:24,29.5,12452
22747,ALARM CLOCK BAKELIKE GREEN,25,12/1/2010 10:24,24.75,12452
22748,ALARM CLOCK BAKELIKE RED ,25,12/1/2010 10:24,24.75,12452
22213,BLUE DINER WALL CLOCK,23,12/1/2010 10:24,29.5,12452
22212,IVORY DINER WALL CLOCK,23,12/1/2010 10:24,29.5,12452
22216,LARGE HEART MEASURING SPOONS,45,12/1/2010 10:24,22.65,12452
22217,SMALL HEART MEASURING SPOONS,45,12/1/2010 10:24,21.85,12452
22962,CHRISTMAS LIGHTS 10 REINDEER,23,12/1/2010 10:40,29.5,17532
22981,JAM MAKING SET WITH JARS,33,12/1/2010 10:40,24.75,17532
22982,JAM MAKING SET PRINTED,33,12/1/2010 10:40,22.45,17532
22983,JAM JAR WITH PINK LID,69,12/1/2010 10:40,21.72,17532
22984,JAM JAR WITH GREEN LID,69,12/1/2010 10:40,21.72,17532
22989,ROSE COTTAGE KEEPSAKE BOX ,29,12/1/2010 10:40,29.5,17532
84991S,HANGING HEART ZINC T-LIGHT HOLDER,165,12/1/2010 10:40,21.64,17532
22931,PAPER CHAIN KIT VINTAGE CHRISTMAS,61,12/1/2010 10:40,23.55,17532
20689,DISCO BALL CHRISTMAS DECORATION,309,12/1/2010 10:40,21.1,17532
85144A,WHITE HANGING HEART T-LIGHT HOLDER,85,12/1/2010 10:40,23.55,17532
22218,SMALL POPCORN HOLDER,121,12/1/2010 10:40,21.72,17532
22219,LARGE POPCORN HOLDER ,71,12/1/2010 10:40,22.45,17532
21554,RETROSPOT LARGE MILK JUG,33,12/1/2010 10:40,25.25,17532
21101,SET/20 RED RETROSPOT PAPER NAPKINS ,117,12/1/2010 10:40,21.64,17532
21115,SET/6 RED SPOTTY PAPER PLATES,117,12/1/2010 10:40,21.64,17532
21107,SET/6 RED SPOTTY PAPER CUPS,69,12/1/2010 10:40,21.65,17532
21807,POLKADOT RAIN HAT ,165,12/1/2010 10:40,21.32,17532
22675,DELUXE SEWING KIT ,61,12/1/2010 10:40,25.95,17532
21506,RETROSPOT HEART HOT WATER BOTTLE,45,12/1/2010 10:40,25.25,17532
84050G,KNITTED UNION FLAG HOT WATER BOTTLE,45,12/1/2010 10:40,24.39,17532
84051E,ENGLISH ROSE HOT WATER BOTTLE,45,12/1/2010 10:40,24.75,17532
22195,PHOTO CUBE,69,12/1/2010 10:40,22.48,17532
22990,HOMEMADE JAM SCENTED CANDLES,117,12/1/2010 10:40,22.25,17532
85120B,JUMBO BAG RED RETROSPOT,121,12/1/2010 10:40,22.65,17532
22577,PLASTERS IN TIN CIRCUS PARADE ,9,12/1/2010 10:45,22.65,17569
22005,PACK OF 12 PINK PAISLEY TISSUES ,-3,12/1/2010 10:45,21.29,17569
22004,PACK OF 12 BLUE PAISLEY TISSUES ,-3,12/1/2010 10:45,21.29,17569
22001,PACK OF 12 RED RETROSPOT TISSUES ,-3,12/1/2010 10:45,21.29,17569
21505,CHICK GREY HOT WATER BOTTLE,9,12/1/2010 10:45,24.45,17569
22578,PLASTERS IN TIN VINTAGE PAISLEY ,9,12/1/2010 10:45,22.65,17569
22574,PLASTERS IN TIN SKULLS,-3,12/1/2010 10:45,22.65,17569
22171,24 STRIPEY MICE FELTCRAFT,27,12/1/2010 10:50,22.95,13726
22640,SET OF 6 SOLDIER SKITTLES,25,12/1/2010 10:50,24.75,13726
21912,TRADITIONAL WOODEN SKIPPING ROPE,33,12/1/2010 10:50,22.25,13726
21910,WOODEN BOX OF DOMINOES,33,12/1/2010 10:50,22.25,13726
22848,RUSTIC  SEVENTEEN DRAWER SIDEBOARD,22,12/1/2010 10:50,186,13726
22148,PARTY CONES CARNIVAL ASSORTED,33,12/1/2010 10:50,22.25,13726
22149,PARTY CONES CANDY ASSORTED,33,12/1/2010 10:50,22.25,13726
22523,PICNIC BASKET WICKER SMALL,25,12/1/2010 10:50,26.95,13726
84900,ASSORTED COLOUR BIRD ORNAMENT,37,12/1/2010 10:50,22.69,13726
22359,STAR DECORATION PAINTED ZINC ,45,12/1/2010 10:50,21.65,13726
22201,RETROSPOT LAMP,29,12/1/2010 10:58,30.95,13768
21527,"FANCY FONT BIRTHDAY CARD, ",45,12/1/2010 10:60,21.42,13429
22654,HAND WARMER UNION JACK,117,12/1/2010 10:60,22.85,13429
22887,HAND WARMER SCOTTY DOG DESIGN,117,12/1/2010 10:60,22.85,13429
22886,HAND WARMER OWL DESIGN,117,12/1/2010 10:60,22.85,13429
22653,HAND WARMER RED RETROSPOT,117,12/1/2010 10:60,22.85,13429
21506,RETROSPOT HEART HOT WATER BOTTLE,33,12/1/2010 10:60,25.95,13429
22370,DOG BOWL CHASING BALL DESIGN,33,12/1/2010 10:60,24.75,13429
22579,CLOTHES PEGS RETROSPOT PACK 24 ,69,12/1/2010 10:60,22.25,13429
85173,HAND OVER THE CHOCOLATE   SIGN ,33,12/1/2010 10:60,23.1,13429
85144A,WHITE HANGING HEART T-LIGHT HOLDER,53,12/1/2010 10:60,23.55,13429
22673,TRAVEL SEWING KIT,41,12/1/2010 10:60,22.65,13429
22209,BLACK HEART CARD HOLDER,29,12/1/2010 10:68,24.95,13788
84900,ASSORTED COLOUR BIRD ORNAMENT,53,12/1/2010 10:68,22.69,13788
21998,PACK OF 60 PINK PAISLEY CAKE CASES,45,12/1/2010 10:68,21.55,13788
85012,81 TEATIME FAIRY CAKE CASES,45,12/1/2010 10:68,21.55,13788
21233,PACK OF 72 RETROSPOT CAKE CASES,45,12/1/2010 10:68,21.55,13788
21505,CHICK GREY HOT WATER BOTTLE,29,12/1/2010 10:68,24.45,13788
21335,SMALL GLASS HEART TRINKET POT,29,12/1/2010 10:68,23.1,13788
22751,ALARM CLOCK BAKELIKE IVORY,25,12/1/2010 10:68,24.75,13788
22748,ALARM CLOCK BAKELIKE RED ,29,12/1/2010 10:68,24.75,13788
22750,ALARM CLOCK BAKELIKE ORANGE,29,12/1/2010 10:68,24.75,13788
22747,ALARM CLOCK BAKELIKE GREEN,29,12/1/2010 10:68,24.75,13788
22135,HOT WATER BOTTLE TEA AND SYMPATHY,29,12/1/2010 10:68,24.95,13788
22888,HAND WARMER BIRD DESIGN,69,12/1/2010 10:68,23.1,13788
22887,HAND WARMER SCOTTY DOG DESIGN,69,12/1/2010 10:68,23.1,13788
85144A,WHITE HANGING HEART T-LIGHT HOLDER,27,12/1/2010 10:72,23.55,17871
71074,WHITE METAL LANTERN,27,12/1/2010 10:72,24.39,17871
84427B,CREAM CUPID HEARTS COAT HANGER,29,12/1/2010 10:72,23.75,17871
15077BL,EDWARDIAN PARASOL BLACK,27,12/1/2010 10:72,25.95,17871
20700,EDWARDIAN PARASOL RED,27,12/1/2010 10:72,25.95,17871
37391,RETRO COFFEE MUGS ASSORTED,27,12/1/2010 10:72,22.06,17871
21892,SAVE THE PLANET MUG,27,12/1/2010 10:72,22.06,17871
21092,VINTAGE BILLBOARD DRINK ME MUG,27,12/1/2010 10:72,22.06,17871
21089,VINTAGE BILLBOARD LOVE/HATE MUG,27,12/1/2010 10:72,22.06,17871
82504,WOOD 2 DRAWER CABINET WHITE FINISH,23,12/1/2010 10:72,25.95,17871
82507,WOOD S/3 CABINET ANT WHITE FINISH,25,12/1/2010 10:72,27.95,17871
82503,WOODEN PICTURE FRAME WHITE FINISH,27,12/1/2010 10:72,23.1,17871
82515L,WOODEN FRAME ANTIQUE WHITE ,33,12/1/2010 10:72,23.55,17871
84050G,KNITTED UNION FLAG HOT WATER BOTTLE,27,12/1/2010 10:72,24.39,17871
84050E,RED WOOLLY HOTTIE WHITE HEART.,27,12/1/2010 10:72,24.39,17871
22773,SET 7 BABUSHKA NESTING BOXES,23,12/1/2010 10:72,28.65,17871
22824,IVORY EMBROIDERED QUILT ,23,12/1/2010 10:72,56.75,17871
21751,GLASS STAR FROSTED T-LIGHT HOLDER,27,12/1/2010 10:72,25.25,17871
35025B,SET OF 3 BLACK FLYING DUCKS,33,12/1/2010 10:72,25.65,17945
35025C,SET OF 3 COLOURED  FLYING DUCKS,69,12/1/2010 10:72,25.65,17945
22001,PACK OF 12 RED RETROSPOT TISSUES ,45,12/1/2010 10:73,21.29,13469
21865,RED RETROSPOT MUG,27,12/1/2010 10:73,23.95,13469
22489,BABUSHKA LIGHTS STRING OF 31,25,12/1/2010 10:73,27.75,13469
22658,PIGGY BANK RETROSPOT ,29,12/1/2010 10:73,23.55,13469
22773,SET 7 BABUSHKA NESTING BOXES,27,12/1/2010 10:73,29.5,13469
48206,DOORMAT FAIRY CAKE,23,12/1/2010 10:73,28.95,13469
22653,HAND WARMER RED RETROSPOT,33,12/1/2010 10:73,23.1,13469
22887,HAND WARMER SCOTTY DOG DESIGN,33,12/1/2010 10:73,23.1,13469
22886,HAND WARMER OWL DESIGN,33,12/1/2010 10:73,23.1,13469
21253,STRAWBERRY CERAMIC TRINKET BOX,33,12/1/2010 10:73,22.25,13469
22085,PINK DOUGHNUT TRINKET POT ,33,12/1/2010 10:73,22.65,13469
22470,SILK PURSE BABUSHKA PINK,27,12/1/2010 10:73,24.35,13469
22135,HOT WATER BOTTLE TEA AND SYMPATHY,25,12/1/2010 10:73,24.95,13469
22856,HOT WATER BOTTLE I AM SO POORLY,29,12/1/2010 10:73,25.65,13469
22133,CHOCOLATE HOT WATER BOTTLE,30,12/1/2010 10:73,25.95,13469
21500,WHITE SKULL HOT WATER BOTTLE ,25,12/1/2010 10:73,24.75,13469
22132,SCOTTIE DOG HOT WATER BOTTLE,30,12/1/2010 10:73,25.95,13469
22653,HAND WARMER RED POLKA DOT,27,12/1/2010 10:73,22.85,17871
22654,HAND WARMER UNION JACK,27,12/1/2010 10:73,22.85,17871
22990,HOMEMADE JAM SCENTED CANDLES,33,12/1/2010 10:74,22.45,13469
22131,BIRD HOUSE HOT WATER BOTTLE,22,12/1/2010 11:42,23.55,15883
22119,BOUDOIR SQUARE TISSUE BOX,22,12/1/2010 11:42,22.25,15883
22121,SKULLS SQUARE TISSUE BOX,23,12/1/2010 11:42,22.25,15883
22787,PHOTO FRAME CORNICE,22,12/1/2010 11:42,23.95,15883
22472,SILK PURSE BABUSHKA RED,22,12/1/2010 11:42,24.35,15883
22570,PICTURE DOMINOES,22,12/1/2010 11:42,22.45,15883
84765,S/6 SEW ON CROCHET FLOWERS,22,12/1/2010 11:42,22.25,15883
85070E,SCANDINAVIAN REDS RIBBONS,23,12/1/2010 11:42,22.25,15883
21349,BALLOONS  WRITING SET ,22,12/1/2010 11:42,22.65,15883
22982,JAM MAKING SET PRINTED,25,12/1/2010 11:42,22.45,15883
17112A,LAVENDER INCENSE IN TIN,22,12/1/2010 11:42,22.25,15883
22494,TV DINNER TRAY VINTAGE PAISLEY,22,12/1/2010 11:42,25.95,15883
84530A,SET OF 4 ENGLISH ROSE PLACEMATS,23,12/1/2010 11:42,24.75,15883
84531A,SET OF 4 ENGLISH ROSE COASTERS,23,12/1/2010 11:42,22.25,15883
22788,TRIPLE PHOTO FRAME CORNICE ,23,12/1/2010 11:42,30.95,15883
22789,FAMILY PHOTO FRAME CORNICE,22,12/1/2010 11:42,30.95,15883
21484,MIRRORED DISCO BALL ,22,12/1/2010 11:42,26.95,15883
21485,DISCO BALL ROTATOR BATTERY OPERATED,22,12/1/2010 11:42,25.25,15883
20841,SILVER LOOKING MIRROR,24,12/1/2010 11:42,25.95,15883
85171,LADIES & GENTLEMEN METAL SIGN,22,12/1/2010 11:42,23.55,15883
22138,METAL SIGN HER DINNER IS SERVED ,22,12/1/2010 11:42,23.95,15883
21190,YOU'RE CONFUSING ME METAL SIGN ,23,12/1/2010 11:42,22.69,15883
48150,DOORMAT TOPIARY,22,12/1/2010 11:42,28.95,15883
82601,BATHROOM METAL SIGN,22,12/1/2010 11:42,21.55,15883
82599,KITCHEN METAL SIGN,22,12/1/2010 11:42,21.55,15883
82602,TOILET METAL SIGN,23,12/1/2010 11:42,21.55,15883
22434,METAL SIGN TAKE IT OR LEAVE IT ,25,12/1/2010 11:42,23.95,15883
StockCode,Description,Quantity,InvoiceDate,UnitPrice,CustomerID
85145A,WHITE HANGING HEART T-LIGHT HOLDER,28,12/1/2010 8:48,24.55,17872
71075,WHITE METAL LANTERN,28,12/1/2010 8:48,25.39,17872
84428B,CREAM CUPID HEARTS COAT HANGER,30,12/1/2010 8:48,24.75,17872
84051G,KNITTED UNION FLAG HOT WATER BOTTLE,28,12/1/2010 8:48,25.39,17872
84051E,RED WOOLLY HOTTIE WHITE HEART.,28,12/1/2010 8:48,25.39,17872
22774,SET 7 BABUSHKA NESTING BOXES,24,12/1/2010 8:48,29.65,17872
21752,GLASS STAR FROSTED T-LIGHT HOLDER,28,12/1/2010 8:48,26.25,17872
22655,HAND WARMER UNION JACK,28,12/1/2010 8:50,23.85,17872
22654,HAND WARMER RED POLKA DOT,28,12/1/2010 8:50,23.85,17872
84901,ASSORTED COLOUR BIRD ORNAMENT,54,12/1/2010 8:56,23.69,13069
22767,POPPY'S PLAYHOUSE BEDROOM ,28,12/1/2010 8:56,24.1,13069
22770,POPPY'S PLAYHOUSE KITCHEN,28,12/1/2010 8:56,24.1,13069
22771,FELTCRAFT PRINCESS CHARLOTTE DOLL,30,12/1/2010 8:56,25.75,13069
22332,IVORY KNITTED MUG COSY ,28,12/1/2010 8:56,23.65,13069
84991,BOX OF 6 ASSORTED COLOUR TEASPOONS,28,12/1/2010 8:56,26.25,13069
22645,BOX OF VINTAGE JIGSAW BLOCKS ,25,12/1/2010 8:56,26.95,13069
22644,BOX OF VINTAGE ALPHABET BLOCKS,24,12/1/2010 8:56,31.95,13069
21776,HOME BUILDING BLOCK WORD,25,12/1/2010 8:56,27.95,13069
21777,LOVE BUILDING BLOCK WORD,25,12/1/2010 8:56,27.95,13069
21799,RECIPE BOX WITH METAL HEART,26,12/1/2010 8:56,29.95,13069
48209,DOORMAT NEW ENGLAND,26,12/1/2010 8:56,29.95,13069
22982,JAM MAKING SET WITH JARS,28,12/1/2010 8:56,26.25,13069
22935,RED COAT RACK PARIS FASHION,25,12/1/2010 8:56,26.95,13069
22934,YELLOW COAT RACK PARIS FASHION,25,12/1/2010 8:56,26.95,13069
22936,BLUE COAT RACK PARIS FASHION,25,12/1/2010 8:56,26.95,13069
21778,BATH BUILDING BLOCK WORD,25,12/1/2010 8:57,27.95,13069
22750,ALARM CLOCK BAKELIKE PINK,46,12/1/2010 8:67,25.75,12605
22749,ALARM CLOCK BAKELIKE RED ,46,12/1/2010 8:67,25.75,12605
22748,ALARM CLOCK BAKELIKE GREEN,34,12/1/2010 8:67,25.75,12605
21746,PANDA AND BUNNIES STICKER SHEET,34,12/1/2010 8:67,22.85,12605
21905,STARS GIFT TAPE ,46,12/1/2010 8:67,22.65,12605
10024,INFLATABLE POLITICAL GLOBE ,70,12/1/2010 8:67,22.85,12605
21813,VINTAGE HEADS AND TAILS CARD GAME ,46,12/1/2010 8:67,23.25,12605
21057,SET/2 RED RETROSPOT TEA TOWELS ,40,12/1/2010 8:67,24.95,12605
22348,ROUND SNACK BOXES SET OF4 WOODLAND ,46,12/1/2010 8:67,24.95,12605
22651,SPACEBOY LUNCH BOX ,46,12/1/2010 8:67,23.95,12605
22681,LUNCH BOX I LOVE LONDON,46,12/1/2010 8:67,23.95,12605
22653,CIRCUS PARADE LUNCH BOX ,46,12/1/2010 8:67,23.95,12605
22683,CHARLOTTE BAG DOLLY GIRL DESIGN,42,12/1/2010 8:67,22.85,12605
21753,RED TOADSTOOL LED NIGHT LIGHT,46,12/1/2010 8:67,23.65,12605
22922, SET 2 TEA TOWELS I LOVE LONDON ,46,12/1/2010 8:67,24.95,12605
21935,VINTAGE SEASIDE JIGSAW PUZZLES,34,12/1/2010 8:67,25.75,12605
22562,MINI JIGSAW CIRCUS PARADE ,46,12/1/2010 8:67,22.42,12605
22566,MINI JIGSAW SPACEBOY,46,12/1/2010 8:67,22.42,12605
22514,MINI PAINT SET VINTAGE ,58,12/1/2010 8:67,22.65,12605
POST,POSTAGE,25,12/1/2010 8:67,40,12605
22108,PAPER CHAIN KIT 50'S CHRISTMAS ,102,12/1/2010 9:22,24.55,13770
22654,HAND WARMER RED POLKA DOT,28,12/1/2010 9:23,23.85,17872
22655,HAND WARMER UNION JACK,28,12/1/2010 9:23,23.85,17872
85145A,WHITE HANGING HEART T-LIGHT HOLDER,28,12/1/2010 9:24,24.55,17872
71075,WHITE METAL LANTERN,28,12/1/2010 9:24,25.39,17872
84428B,CREAM CUPID HEARTS COAT HANGER,30,12/1/2010 9:24,24.75,17872
20701,EDWARDIAN PARASOL RED,28,12/1/2010 9:24,26.95,17872
37392,RETRO COFFEE MUGS ASSORTED,28,12/1/2010 9:24,23.06,17872
21893,SAVE THE PLANET MUG,28,12/1/2010 9:24,23.06,17872
21093,VINTAGE BILLBOARD DRINK ME MUG,28,12/1/2010 9:24,23.06,17872
21090,VINTAGE BILLBOARD LOVE/HATE MUG,28,12/1/2010 9:24,23.06,17872
82505,WOOD 2 DRAWER CABINET WHITE FINISH,24,12/1/2010 9:24,26.95,17872
82508,WOOD S/3 CABINET ANT WHITE FINISH,26,12/1/2010 9:24,28.95,17872
82504,WOODEN PICTURE FRAME WHITE FINISH,28,12/1/2010 9:24,24.1,17872
82516L,WOODEN FRAME ANTIQUE WHITE ,28,12/1/2010 9:24,24.55,17872
84051G,KNITTED UNION FLAG HOT WATER BOTTLE,28,12/1/2010 9:24,25.39,17872
84051E,RED WOOLLY HOTTIE WHITE HEART.,28,12/1/2010 9:24,25.39,17872
22774,SET 7 BABUSHKA NESTING BOXES,24,12/1/2010 9:24,29.65,17872
21752,GLASS STAR FROSTED T-LIGHT HOLDER,28,12/1/2010 9:24,26.25,17872
21280,VICTORIAN SEWING BOX LARGE,54,12/1/2010 9:31,32.95,15122
85145A,WHITE HANGING HEART T-LIGHT HOLDER,28,12/1/2010 9:54,24.55,17872
71075,WHITE METAL LANTERN,28,12/1/2010 9:54,25.39,17872
84428B,CREAM CUPID HEARTS COAT HANGER,30,12/1/2010 9:54,24.75,17872
20701,EDWARDIAN PARASOL RED,28,12/1/2010 9:54,26.95,17872
37392,RETRO COFFEE MUGS ASSORTED,28,12/1/2010 9:54,23.06,17872
21893,SAVE THE PLANET MUG,28,12/1/2010 9:54,23.06,17872
21093,VINTAGE BILLBOARD DRINK ME MUG,28,12/1/2010 9:54,23.06,17872
21090,VINTAGE BILLBOARD LOVE/HATE MUG,28,12/1/2010 9:54,23.06,17872
