StockCode,Description,Quantity,InvoiceDate,UnitPrice,CustomerID
10016,INFLATABLE POLITICAL GLOBE ,62,12/1/2010 8:59,14.85,12597
21805,VINTAGE HEADS AND TAILS CARD GAME ,38,12/1/2010 8:59,15.25,12597
21049,SET/2 RED RETROSPOT TEA TOWELS ,32,12/1/2010 8:59,16.95,12597
22340,ROUND SNACK BOXES SET OF4 WOODLAND ,38,12/1/2010 8:59,16.95,12597
22643,SPACEBOY LUNCH BOX ,38,12/1/2010 8:59,15.95,12597
22673,LUNCH BOX I LOVE LONDON,38,12/1/2010 8:59,15.95,12597
22645,CIRCUS PARADE LUNCH BOX ,38,12/1/2010 8:59,15.95,12597
22675,CHARLOTTE BAG DOLLY GIRL DESIGN,34,12/1/2010 8:59,14.85,12597
21745,RED TOADSTOOL LED NIGHT LIGHT,38,12/1/2010 8:59,15.65,12597
22914, SET 2 TEA TOWELS I LOVE LONDON ,38,12/1/2010 8:59,16.95,12597
21927,VINTAGE SEASIDE JIGSAW PUZZLES,26,12/1/2010 8:59,17.75,12597
22554,MINI JIGSAW CIRCUS PARADE ,38,12/1/2010 8:59,14.42,12597
22558,MINI JIGSAW SPACEBOY,38,12/1/2010 8:59,14.42,12597
22506,MINI PAINT SET VINTAGE ,50,12/1/2010 8:59,14.65,12597
POST,POSTAGE,17,12/1/2010 8:59,32,12597
22100,PAPER CHAIN KIT 50'S CHRISTMAS ,94,12/1/2010 9:14,16.55,13762
22646,HAND WARMER RED POLKA DOT,20,12/1/2010 9:15,15.85,17864
22647,HAND WARMER UNION JACK,20,12/1/2010 9:15,15.85,17864
85137A,WHITE HANGING HEART T-LIGHT HOLDER,20,12/1/2010 9:16,16.55,17864
71067,WHITE METAL LANTERN,20,12/1/2010 9:16,17.39,17864
84420B,CREAM CUPID HEARTS COAT HANGER,22,12/1/2010 9:16,16.75,17864
20693,EDWARDIAN PARASOL RED,20,12/1/2010 9:16,18.95,17864
37384,RETRO COFFEE MUGS ASSORTED,20,12/1/2010 9:16,15.06,17864
21885,SAVE THE PLANET MUG,20,12/1/2010 9:16,15.06,17864
21085,VINTAGE BILLBOARD DRINK ME MUG,20,12/1/2010 9:16,15.06,17864
21082,VINTAGE BILLBOARD LOVE/HATE MUG,20,12/1/2010 9:16,15.06,17864
82497,WOOD 2 DRAWER CABINET WHITE FINISH,16,12/1/2010 9:16,18.95,17864
82500,WOOD S/3 CABINET ANT WHITE FINISH,18,12/1/2010 9:16,20.95,17864
82496,WOODEN PICTURE FRAME WHITE FINISH,20,12/1/2010 9:16,16.1,17864
82508L,WOODEN FRAME ANTIQUE WHITE ,20,12/1/2010 9:16,16.55,17864
84043G,KNITTED UNION FLAG HOT WATER BOTTLE,20,12/1/2010 9:16,17.39,17864
84043E,RED WOOLLY HOTTIE WHITE HEART.,20,12/1/2010 9:16,17.39,17864
22766,SET 7 BABUSHKA NESTING BOXES,16,12/1/2010 9:16,21.65,17864
21744,GLASS STAR FROSTED T-LIGHT HOLDER,20,12/1/2010 9:16,18.25,17864
21272,VICTORIAN SEWING BOX LARGE,46,12/1/2010 9:23,24.95,15114
85137A,WHITE HANGING HEART T-LIGHT HOLDER,20,12/1/2010 9:46,16.55,17864
71067,WHITE METAL LANTERN,20,12/1/2010 9:46,17.39,17864
84420B,CREAM CUPID HEARTS COAT HANGER,22,12/1/2010 9:46,16.75,17864
20693,EDWARDIAN PARASOL RED,20,12/1/2010 9:46,18.95,17864
37384,RETRO COFFEE MUGS ASSORTED,20,12/1/2010 9:46,15.06,17864
21885,SAVE THE PLANET MUG,20,12/1/2010 9:46,15.06,17864
21085,VINTAGE BILLBOARD DRINK ME MUG,20,12/1/2010 9:46,15.06,17864
21082,VINTAGE BILLBOARD LOVE/HATE MUG,20,12/1/2010 9:46,15.06,17864
82497,WOOD 2 DRAWER CABINET WHITE FINISH,16,12/1/2010 9:46,18.95,17864
82500,WOOD S/3 CABINET ANT WHITE FINISH,18,12/1/2010 9:46,20.95,17864
82496,WOODEN PICTURE FRAME WHITE FINISH,20,12/1/2010 9:46,16.1,17864
82508L,WOODEN FRAME ANTIQUE WHITE ,20,12/1/2010 9:46,16.55,17864
84043G,KNITTED UNION FLAG HOT WATER BOTTLE,20,12/1/2010 9:46,17.39,17864
84043E,RED WOOLLY HOTTIE WHITE HEART.,20,12/1/2010 9:46,17.39,17864
22766,SET 7 BABUSHKA NESTING BOXES,16,12/1/2010 9:46,21.65,17864
21744,GLASS STAR FROSTED T-LIGHT HOLDER,20,12/1/2010 9:46,18.25,17864
22128,HOT WATER BOTTLE TEA AND SYMPATHY,62,12/1/2010 9:46,17.45,15305
21747,RED HANGING HEART T-LIGHT HOLDER,78,12/1/2010 9:46,16.55,15305
22646,HAND WARMER RED POLKA DOT,20,12/1/2010 9:48,15.85,17864
22647,HAND WARMER UNION JACK,20,12/1/2010 9:48,15.85,17864
22400,JUMBO BAG PINK POLKADOT,24,12/1/2010 9:51,15.95,14702
85113C,JUMBO  BAG BAROQUE BLACK WHITE,24,12/1/2010 9:51,15.95,14702
21047,JUMBO BAG CHARLIE AND LOLA TOYS,24,12/1/2010 9:51,16.95,14702
20737,STRAWBERRY CHARLOTTE BAG,24,12/1/2010 9:51,14.85,14702
85011B,RED 3 PIECE RETROSPOT CUTLERY SET,26,12/1/2010 9:51,17.75,14702
85011C,BLUE 3 PIECE POLKADOT CUTLERY SET,20,12/1/2010 9:51,17.75,14702
21108,SET/6 RED SPOTTY PAPER PLATES,26,12/1/2010 9:51,14.85,14702
20739,LUNCH BAG RED RETROSPOT,24,12/1/2010 9:51,15.65,14702
21573,STRAWBERRY LUNCH BOX WITH CUTLERY,20,12/1/2010 9:51,16.55,14702
22366,LUNCH BOX WITH CUTLERY RETROSPOT ,20,12/1/2010 9:51,16.55,14702
21226,PACK OF 72 RETROSPOT CAKE CASES,134,12/1/2010 9:51,14.42,14702
21989,PACK OF 60 DINOSAUR CAKE CASES,38,12/1/2010 9:51,14.55,14702
21991,PACK OF 60 PINK PAISLEY CAKE CASES,38,12/1/2010 9:51,14.55,14702
85005,74 TEATIME FAIRY CAKE CASES,38,12/1/2010 9:51,14.55,14702
84533A,TOMATO CHARLIE+LOLA COASTER SET,20,12/1/2010 9:51,16.95,14702
85197B,CHARLIE & LOLA WASTEPAPER BIN FLORA,62,12/1/2010 9:51,15.25,14702
85085B,RED CHARLIE+LOLA PERSONAL DOORSIGN,110,12/1/2010 9:51,14.38,14702
21945,JUMBO STORAGE BAG SUKI,24,12/1/2010 9:51,15.95,14702
21943,JUMBO BAG PINK VINTAGE PAISLEY,24,12/1/2010 9:51,15.95,14702
22975,JAM MAKING SET PRINTED,38,12/1/2010 9:55,15.45,17823
22153,RETROSPOT TEA SET CERAMIC 11 PC ,37,12/1/2010 9:55,18.25,15325
84868,GIRLY PINK TOOL SET,19,12/1/2010 9:55,18.95,15325
22425,JUMBO SHOPPER VINTAGE RED PAISLEY,24,12/1/2010 9:55,15.95,15325
82581,"AIRLINE LOUNGE,METAL SIGN",16,12/1/2010 9:55,16.1,15325
21686,WHITE SPOT RED CERAMIC DRAWER KNOB,20,12/1/2010 9:55,15.25,15325
22788,RED DRAWER KNOB ACRYLIC EDWARDIAN,38,12/1/2010 9:55,15.25,15325
22785,CLEAR DRAWER KNOB ACRYLIC EDWARDIAN,38,12/1/2010 9:55,15.25,15325
71284,PHOTO CLIP LINE,15,12/1/2010 9:55,15.25,15325
22276,FELT EGG COSY CHICKEN,15,12/1/2010 9:55,14.85,15325
22651,PIGGY BANK RETROSPOT ,15,12/1/2010 9:55,16.55,15325
21948,SKULL SHOULDER BAG,24,12/1/2010 9:55,15.65,15325
21183,YOU'RE CONFUSING ME METAL SIGN ,17,12/1/2010 9:55,15.69,15325
21180,COOK WITH WINE METAL SIGN ,15,12/1/2010 9:55,15.95,15325
21189,GIN + TONIC DIET METAL SIGN,16,12/1/2010 9:55,16.1,15325
37458A,YELLOW BREAKFAST CUP AND SAUCER,15,12/1/2010 9:55,16.95,15325
37458C,PINK BREAKFAST CUP AND SAUCER ,15,12/1/2010 9:55,16.95,15325
22100,PAPER CHAIN KIT 50'S CHRISTMAS ,18,12/1/2010 9:55,16.95,15325
22097,PAPER CHAIN KIT RETROSPOT,15,12/1/2010 9:55,16.95,15325
84985S,SMALL HEART FLOWERS HOOK ,20,12/1/2010 9:55,14.85,15325
71284,PHOTO CLIP LINE,17,12/1/2010 9:55,15.25,15325
47594,TEA TIME DES TEA COSY,16,12/1/2010 9:55,16.55,15325
22275,FELT EGG COSY WHITE RABBIT ,15,12/1/2010 9:55,14.85,15325
84846,ZINC WILLIE WINKIE  CANDLE STICK,15,12/1/2010 9:55,14.85,15325
22658,CERAMIC CHERRY CAKE MONEY BANK,15,12/1/2010 9:55,15.45,15325
21547,RETROSPOT LARGE MILK JUG,15,12/1/2010 9:55,18.95,15325
21571,SET OF 6 FUNKY BEAKERS,16,12/1/2010 9:55,16.95,15325
15070BL,EDWARDIAN PARASOL BLACK,16,12/1/2010 9:55,19.95,15325
15070N,EDWARDIAN PARASOL NATURAL,16,12/1/2010 9:55,19.95,15325
22660,CERAMIC STRAWBERRY CAKE MONEY BANK,18,12/1/2010 9:55,15.45,15325
22190,BLUE OWL SOFT TOY,15,12/1/2010 9:55,16.95,15325
22452,BALLOON ART MAKE YOUR OWN FLOWERS,15,12/1/2010 9:55,15.95,15325
21745,RED TOADSTOOL LED NIGHT LIGHT,16,12/1/2010 9:55,15.65,15325
22792,GLASS CLOCHE SMALL,17,12/1/2010 9:55,17.95,15325
22733,GUMBALL MONOCHROME COAT RACK,50,12/1/2010 9:55,15.06,15325
21537,DOORMAT FANCY FONT HOME SWEET HOME,24,12/1/2010 9:55,20.75,15325
D,Discount,13,12/1/2010 9:55,41.5,14541
10016,INFLATABLE POLITICAL GLOBE ,26,12/1/2010 9:59,14.85,16112
21926,VINTAGE SNAKES & LADDERS,22,12/1/2010 9:59,17.75,16112
21846,CHOCOLATE CALCULATOR,26,12/1/2010 9:59,15.65,16112
22425,JUMBO SHOPPER VINTAGE RED PAISLEY,24,12/1/2010 9:59,15.95,16112
22393,RECYCLING BAG RETROSPOT ,24,12/1/2010 9:59,16.1,16112
22395,TOY TIDY PINK POLKADOT,64,12/1/2010 9:59,15.85,16112
22812,ANTIQUE GLASS DRESSING TABLE POT,22,12/1/2010 9:59,16.95,16112
22740,ALARM CLOCK BAKELIKE GREEN,18,12/1/2010 9:59,17.75,16112
22940,IVORY GIANT GARDEN THERMOMETER,26,12/1/2010 9:59,19.95,16112
22853,17 TIER CAKE TIN GREEN AND CREAM,16,12/1/2010 9:59,28.95,16112
22852,17 TIER CAKE TIN RED AND CREAM,16,12/1/2010 9:59,28.95,16112
22797,SET 3 WICKER OVAL BASKETS W LIDS,18,12/1/2010 9:59,30.95,16112
35018C,SET OF 3 COLOURED  FLYING DUCKS,13,12/1/2010 9:63,18.65,15325
82498,WOOD BLACK BOARD ANT WHITE FINISH,17,12/1/2010 9:67,20.45,18088
84769,COLOUR GLASS T-LIGHT HOLDER HANGING,62,12/1/2010 9:67,14.65,18088
22478,HANGING METAL HEART LANTERN,26,12/1/2010 9:67,15.65,18088
21338,HANGING MEDINA LANTERN SMALL,20,12/1/2010 9:67,16.95,18088
22471,NATURAL SLATE HEART CHALKBOARD ,26,12/1/2010 9:67,16.95,18088
22483,HEART OF WICKER SMALL,54,12/1/2010 9:67,15.45,18088
22484,HEART OF WICKER LARGE,54,12/1/2010 9:67,16.55,18088
22238,WHITE LOVEBIRD LANTERN,20,12/1/2010 9:67,16.95,18088
21354,CLASSIC METAL BIRDCAGE PLANT HOLDER,16,12/1/2010 9:67,26.75,18088
22203,CREAM HEART CARD HOLDER,18,12/1/2010 9:67,17.95,18088
22441,ENAMEL FLOWER JUG CREAM,17,12/1/2010 9:67,19.95,18088
22442,ENAMEL FIRE BUCKET CREAM,20,12/1/2010 9:67,20.95,18088
22438,ENAMEL BREAD BIN CREAM,22,12/1/2010 9:67,24.95,18088
22797,SET 3 WICKER OVAL BASKETS W LIDS,15,12/1/2010 9:70,33.95,17434
22975,JAM MAKING SET PRINTED,26,12/1/2010 9:70,15.45,17434
22974,JAM MAKING SET WITH JARS,20,12/1/2010 9:70,18.25,17434
22677,JUMBO BAG DOLLY GIRL DESIGN,24,12/1/2010 9:70,15.95,17434
85063A,TRADITIONAL CHRISTMAS RIBBONS,26,12/1/2010 9:70,15.25,17434
22182,ORGANISER WOOD ANTIQUE WHITE ,16,12/1/2010 9:70,22.5,17434
22676,LUNCH BAG DOLLY GIRL DESIGN,24,12/1/2010 9:70,15.65,17434
84894,WHITE WIRE EGG HOLDER,50,12/1/2010 9:71,18.95,16043
85113C,JUMBO  BAG BAROQUE BLACK WHITE,114,12/1/2010 9:71,15.65,16043
85113B,JUMBO BAG RED RETROSPOT,114,12/1/2010 9:71,15.65,16043
79335,CHILLI LIGHTS,206,12/1/2010 9:72,17.82,16043
22794,LIGHT GARLAND BUTTERFILES PINK,206,12/1/2010 9:72,17.37,16043
22793,WOODEN OWLS LIGHT GARLAND ,206,12/1/2010 9:72,17.37,16043
22480,FAIRY TALE COTTAGE NIGHTLIGHT,446,12/1/2010 9:72,15.45,16043
21745,RED TOADSTOOL LED NIGHT LIGHT,446,12/1/2010 9:72,15.25,16043
21768,HOME BUILDING BLOCK WORD,17,12/1/2010 9:73,19.95,16264
21769,LOVE BUILDING BLOCK WORD,17,12/1/2010 9:73,19.95,16264
21537,DOORMAT FANCY FONT HOME SWEET HOME,16,12/1/2010 9:73,21.95,16264
21377,HOME SMALL WOOD LETTERS,17,12/1/2010 9:73,18.95,16264
21425,GINGHAM HEART  DOORSTOP RED,17,12/1/2010 9:73,18.25,16264
22332,FIVE HEART HANGING DECORATION,20,12/1/2010 9:73,16.95,16264
22478,HANGING METAL HEART LANTERN,26,12/1/2010 9:73,15.65,16264
22929,ASSORTED BOTTLE TOP  MAGNETS ,26,12/1/2010 9:73,14.42,16264
22936,FRIDGE MAGNETS US DINER ASSORTED,26,12/1/2010 9:73,14.85,16264
22983,HOMEMADE JAM SCENTED CANDLES,26,12/1/2010 9:73,15.45,16264
22937,FRIDGE MAGNETS LES ENFANTS ASSORTED,26,12/1/2010 9:73,14.85,16264
21129,ROSE CARAVAN DOORSTOP,18,12/1/2010 9:73,20.75,16264
22483,HEART OF WICKER SMALL,26,12/1/2010 9:73,15.65,16264
22256,19 HOOK HANGER MAGIC TOADSTOOL,26,12/1/2010 9:73,15.65,16264
22955,CHRISTMAS LIGHTS 10 REINDEER,20,12/1/2010 10:17,22.5,12445
21636,VINTAGE UNION JACK CUSHION COVER,22,12/1/2010 10:17,18.95,12445
21805,VINTAGE HEADS AND TAILS CARD GAME ,26,12/1/2010 10:17,15.25,12445
35018C,SET OF 3 COLOURED  FLYING DUCKS,20,12/1/2010 10:17,19.45,12445
35018G,SET OF 3 GOLD FLYING DUCKS,18,12/1/2010 10:17,20.35,12445
85028B,RED RETROSPOT UMBRELLA,20,12/1/2010 10:17,19.95,12445
85028A,BLACK/BLUE POLKADOT UMBRELLA,17,12/1/2010 10:17,19.95,12445
22207,RED DINER WALL CLOCK,16,12/1/2010 10:17,22.5,12445
22740,ALARM CLOCK BAKELIKE GREEN,18,12/1/2010 10:17,17.75,12445
22741,ALARM CLOCK BAKELIKE RED ,18,12/1/2010 10:17,17.75,12445
22206,BLUE DINER WALL CLOCK,16,12/1/2010 10:17,22.5,12445
22205,IVORY DINER WALL CLOCK,16,12/1/2010 10:17,22.5,12445
22209,LARGE HEART MEASURING SPOONS,38,12/1/2010 10:17,15.65,12445
22210,SMALL HEART MEASURING SPOONS,38,12/1/2010 10:17,14.85,12445
22955,CHRISTMAS LIGHTS 10 REINDEER,16,12/1/2010 10:33,22.5,17525
22974,JAM MAKING SET WITH JARS,26,12/1/2010 10:33,17.75,17525
22975,JAM MAKING SET PRINTED,26,12/1/2010 10:33,15.45,17525
22976,JAM JAR WITH PINK LID,62,12/1/2010 10:33,14.72,17525
22977,JAM JAR WITH GREEN LID,62,12/1/2010 10:33,14.72,17525
22982,ROSE COTTAGE KEEPSAKE BOX ,22,12/1/2010 10:33,22.5,17525
84984S,HANGING HEART ZINC T-LIGHT HOLDER,158,12/1/2010 10:33,14.64,17525
22924,PAPER CHAIN KIT VINTAGE CHRISTMAS,54,12/1/2010 10:33,16.55,17525
20682,DISCO BALL CHRISTMAS DECORATION,302,12/1/2010 10:33,14.1,17525
85137A,WHITE HANGING HEART T-LIGHT HOLDER,78,12/1/2010 10:33,16.55,17525
22211,SMALL POPCORN HOLDER,114,12/1/2010 10:33,14.72,17525
22212,LARGE POPCORN HOLDER ,64,12/1/2010 10:33,15.45,17525
21547,RETROSPOT LARGE MILK JUG,26,12/1/2010 10:33,18.25,17525
21094,SET/20 RED RETROSPOT PAPER NAPKINS ,110,12/1/2010 10:33,14.64,17525
21108,SET/6 RED SPOTTY PAPER PLATES,110,12/1/2010 10:33,14.64,17525
21100,SET/6 RED SPOTTY PAPER CUPS,62,12/1/2010 10:33,14.65,17525
21800,POLKADOT RAIN HAT ,158,12/1/2010 10:33,14.32,17525
22668,DELUXE SEWING KIT ,54,12/1/2010 10:33,18.95,17525
21499,RETROSPOT HEART HOT WATER BOTTLE,38,12/1/2010 10:33,18.25,17525
84043G,KNITTED UNION FLAG HOT WATER BOTTLE,38,12/1/2010 10:33,17.39,17525
84044E,ENGLISH ROSE HOT WATER BOTTLE,38,12/1/2010 10:33,17.75,17525
22188,PHOTO CUBE,62,12/1/2010 10:33,15.48,17525
22983,HOMEMADE JAM SCENTED CANDLES,110,12/1/2010 10:33,15.25,17525
85113B,JUMBO BAG RED RETROSPOT,114,12/1/2010 10:33,15.65,17525
22570,PLASTERS IN TIN CIRCUS PARADE ,2,12/1/2010 10:38,15.65,17562
21998,PACK OF 12 PINK PAISLEY TISSUES ,-10,12/1/2010 10:38,14.29,17562
21997,PACK OF 12 BLUE PAISLEY TISSUES ,-10,12/1/2010 10:38,14.29,17562
21994,PACK OF 12 RED RETROSPOT TISSUES ,-10,12/1/2010 10:38,14.29,17562
21498,CHICK GREY HOT WATER BOTTLE,2,12/1/2010 10:38,17.45,17562
22571,PLASTERS IN TIN VINTAGE PAISLEY ,2,12/1/2010 10:38,15.65,17562
22567,PLASTERS IN TIN SKULLS,-10,12/1/2010 10:38,15.65,17562
22164,17 STRIPEY MICE FELTCRAFT,20,12/1/2010 10:43,15.95,13719
22633,SET OF 6 SOLDIER SKITTLES,18,12/1/2010 10:43,17.75,13719
21905,TRADITIONAL WOODEN SKIPPING ROPE,26,12/1/2010 10:43,15.25,13719
21903,WOODEN BOX OF DOMINOES,26,12/1/2010 10:43,15.25,13719
22841,RUSTIC  SEVENTEEN DRAWER SIDEBOARD,15,12/1/2010 10:43,179,13719
22141,PARTY CONES CARNIVAL ASSORTED,26,12/1/2010 10:43,15.25,13719
22142,PARTY CONES CANDY ASSORTED,26,12/1/2010 10:43,15.25,13719
22516,PICNIC BASKET WICKER SMALL,18,12/1/2010 10:43,19.95,13719
84893,ASSORTED COLOUR BIRD ORNAMENT,30,12/1/2010 10:43,15.69,13719
22352,STAR DECORATION PAINTED ZINC ,38,12/1/2010 10:43,14.65,13719
22194,RETROSPOT LAMP,22,12/1/2010 10:51,23.95,13761
21520,"FANCY FONT BIRTHDAY CARD, ",38,12/1/2010 10:53,14.42,13422
22647,HAND WARMER UNION JACK,110,12/1/2010 10:53,15.85,13422
22880,HAND WARMER SCOTTY DOG DESIGN,110,12/1/2010 10:53,15.85,13422
22879,HAND WARMER OWL DESIGN,110,12/1/2010 10:53,15.85,13422
22646,HAND WARMER RED RETROSPOT,110,12/1/2010 10:53,15.85,13422
21499,RETROSPOT HEART HOT WATER BOTTLE,26,12/1/2010 10:53,18.95,13422
22363,DOG BOWL CHASING BALL DESIGN,26,12/1/2010 10:53,17.75,13422
22572,CLOTHES PEGS RETROSPOT PACK 24 ,62,12/1/2010 10:53,15.25,13422
85166,HAND OVER THE CHOCOLATE   SIGN ,26,12/1/2010 10:53,16.1,13422
85137A,WHITE HANGING HEART T-LIGHT HOLDER,46,12/1/2010 10:53,16.55,13422
22666,TRAVEL SEWING KIT,34,12/1/2010 10:53,15.65,13422
22202,BLACK HEART CARD HOLDER,22,12/1/2010 10:61,17.95,13781
84893,ASSORTED COLOUR BIRD ORNAMENT,46,12/1/2010 10:61,15.69,13781
21991,PACK OF 60 PINK PAISLEY CAKE CASES,38,12/1/2010 10:61,14.55,13781
85005,74 TEATIME FAIRY CAKE CASES,38,12/1/2010 10:61,14.55,13781
21226,PACK OF 72 RETROSPOT CAKE CASES,38,12/1/2010 10:61,14.55,13781
21498,CHICK GREY HOT WATER BOTTLE,22,12/1/2010 10:61,17.45,13781
21328,SMALL GLASS HEART TRINKET POT,22,12/1/2010 10:61,16.1,13781
22744,ALARM CLOCK BAKELIKE IVORY,18,12/1/2010 10:61,17.75,13781
22741,ALARM CLOCK BAKELIKE RED ,22,12/1/2010 10:61,17.75,13781
22743,ALARM CLOCK BAKELIKE ORANGE,22,12/1/2010 10:61,17.75,13781
22740,ALARM CLOCK BAKELIKE GREEN,22,12/1/2010 10:61,17.75,13781
22128,HOT WATER BOTTLE TEA AND SYMPATHY,22,12/1/2010 10:61,17.95,13781
22881,HAND WARMER BIRD DESIGN,62,12/1/2010 10:61,16.1,13781
22880,HAND WARMER SCOTTY DOG DESIGN,62,12/1/2010 10:61,16.1,13781
85137A,WHITE HANGING HEART T-LIGHT HOLDER,20,12/1/2010 10:65,16.55,17864
71067,WHITE METAL LANTERN,20,12/1/2010 10:65,17.39,17864
84420B,CREAM CUPID HEARTS COAT HANGER,22,12/1/2010 10:65,16.75,17864
15070BL,EDWARDIAN PARASOL BLACK,20,12/1/2010 10:65,18.95,17864
20693,EDWARDIAN PARASOL RED,20,12/1/2010 10:65,18.95,17864
37384,RETRO COFFEE MUGS ASSORTED,20,12/1/2010 10:65,15.06,17864
21885,SAVE THE PLANET MUG,20,12/1/2010 10:65,15.06,17864
21085,VINTAGE BILLBOARD DRINK ME MUG,20,12/1/2010 10:65,15.06,17864
21082,VINTAGE BILLBOARD LOVE/HATE MUG,20,12/1/2010 10:65,15.06,17864
82497,WOOD 2 DRAWER CABINET WHITE FINISH,16,12/1/2010 10:65,18.95,17864
82500,WOOD S/3 CABINET ANT WHITE FINISH,18,12/1/2010 10:65,20.95,17864
82496,WOODEN PICTURE FRAME WHITE FINISH,20,12/1/2010 10:65,16.1,17864
82508L,WOODEN FRAME ANTIQUE WHITE ,26,12/1/2010 10:65,16.55,17864
84043G,KNITTED UNION FLAG HOT WATER BOTTLE,20,12/1/2010 10:65,17.39,17864
84043E,RED WOOLLY HOTTIE WHITE HEART.,20,12/1/2010 10:65,17.39,17864
22766,SET 7 BABUSHKA NESTING BOXES,16,12/1/2010 10:65,21.65,17864
22817,IVORY EMBROIDERED QUILT ,16,12/1/2010 10:65,49.75,17864
21744,GLASS STAR FROSTED T-LIGHT HOLDER,20,12/1/2010 10:65,18.25,17864
35018B,SET OF 3 BLACK FLYING DUCKS,26,12/1/2010 10:65,18.65,17938
35018C,SET OF 3 COLOURED  FLYING DUCKS,62,12/1/2010 10:65,18.65,17938
21994,PACK OF 12 RED RETROSPOT TISSUES ,38,12/1/2010 10:66,14.29,13462
21858,RED RETROSPOT MUG,20,12/1/2010 10:66,16.95,13462
22482,BABUSHKA LIGHTS STRING OF 24,18,12/1/2010 10:66,20.75,13462
22651,PIGGY BANK RETROSPOT ,22,12/1/2010 10:66,16.55,13462
22766,SET 7 BABUSHKA NESTING BOXES,20,12/1/2010 10:66,22.5,13462
48199,DOORMAT FAIRY CAKE,16,12/1/2010 10:66,21.95,13462
22646,HAND WARMER RED RETROSPOT,26,12/1/2010 10:66,16.1,13462
22880,HAND WARMER SCOTTY DOG DESIGN,26,12/1/2010 10:66,16.1,13462
22879,HAND WARMER OWL DESIGN,26,12/1/2010 10:66,16.1,13462
21246,STRAWBERRY CERAMIC TRINKET BOX,26,12/1/2010 10:66,15.25,13462
22078,PINK DOUGHNUT TRINKET POT ,26,12/1/2010 10:66,15.65,13462
22463,SILK PURSE BABUSHKA PINK,20,12/1/2010 10:66,17.35,13462
22128,HOT WATER BOTTLE TEA AND SYMPATHY,18,12/1/2010 10:66,17.95,13462
22849,HOT WATER BOTTLE I AM SO POORLY,22,12/1/2010 10:66,18.65,13462
22126,CHOCOLATE HOT WATER BOTTLE,23,12/1/2010 10:66,18.95,13462
21493,WHITE SKULL HOT WATER BOTTLE ,18,12/1/2010 10:66,17.75,13462
22125,SCOTTIE DOG HOT WATER BOTTLE,23,12/1/2010 10:66,18.95,13462
22646,HAND WARMER RED POLKA DOT,20,12/1/2010 10:66,15.85,17864
22647,HAND WARMER UNION JACK,20,12/1/2010 10:66,15.85,17864
22983,HOMEMADE JAM SCENTED CANDLES,26,12/1/2010 10:67,15.45,13462
22124,BIRD HOUSE HOT WATER BOTTLE,15,12/1/2010 11:35,16.55,15876
22112,BOUDOIR SQUARE TISSUE BOX,15,12/1/2010 11:35,15.25,15876
22114,SKULLS SQUARE TISSUE BOX,16,12/1/2010 11:35,15.25,15876
22780,PHOTO FRAME CORNICE,15,12/1/2010 11:35,16.95,15876
22465,SILK PURSE BABUSHKA RED,15,12/1/2010 11:35,17.35,15876
22563,PICTURE DOMINOES,15,12/1/2010 11:35,15.45,15876
84758,S/6 SEW ON CROCHET FLOWERS,15,12/1/2010 11:35,15.25,15876
85063E,SCANDINAVIAN REDS RIBBONS,16,12/1/2010 11:35,15.25,15876
21342,BALLOONS  WRITING SET ,15,12/1/2010 11:35,15.65,15876
22975,JAM MAKING SET PRINTED,18,12/1/2010 11:35,15.45,15876
17105A,LAVENDER INCENSE IN TIN,15,12/1/2010 11:35,15.25,15876
22487,TV DINNER TRAY VINTAGE PAISLEY,15,12/1/2010 11:35,18.95,15876
84523A,SET OF 4 ENGLISH ROSE PLACEMATS,16,12/1/2010 11:35,17.75,15876
84524A,SET OF 4 ENGLISH ROSE COASTERS,16,12/1/2010 11:35,15.25,15876
22781,TRIPLE PHOTO FRAME CORNICE ,16,12/1/2010 11:35,23.95,15876
22782,FAMILY PHOTO FRAME CORNICE,15,12/1/2010 11:35,23.95,15876
21477,MIRRORED DISCO BALL ,15,12/1/2010 11:35,19.95,15876
21478,DISCO BALL ROTATOR BATTERY OPERATED,15,12/1/2010 11:35,18.25,15876
20834,SILVER LOOKING MIRROR,17,12/1/2010 11:35,18.95,15876
85164,LADIES & GENTLEMEN METAL SIGN,15,12/1/2010 11:35,16.55,15876
22131,METAL SIGN HER DINNER IS SERVED ,15,12/1/2010 11:35,16.95,15876
21183,YOU'RE CONFUSING ME METAL SIGN ,16,12/1/2010 11:35,15.69,15876
48143,DOORMAT TOPIARY,15,12/1/2010 11:35,21.95,15876
82594,BATHROOM METAL SIGN,15,12/1/2010 11:35,14.55,15876
82592,KITCHEN METAL SIGN,15,12/1/2010 11:35,14.55,15876
82595,TOILET METAL SIGN,16,12/1/2010 11:35,14.55,15876
22427,METAL SIGN TAKE IT OR LEAVE IT ,18,12/1/2010 11:35,16.95,15876
StockCode,Description,Quantity,InvoiceDate,UnitPrice,CustomerID
85138A,WHITE HANGING HEART T-LIGHT HOLDER,21,12/1/2010 8:41,17.55,17865
71068,WHITE METAL LANTERN,21,12/1/2010 8:41,18.39,17865
84421B,CREAM CUPID HEARTS COAT HANGER,23,12/1/2010 8:41,17.75,17865
84044G,KNITTED UNION FLAG HOT WATER BOTTLE,21,12/1/2010 8:41,18.39,17865
84044E,RED WOOLLY HOTTIE WHITE HEART.,21,12/1/2010 8:41,18.39,17865
22767,SET 7 BABUSHKA NESTING BOXES,17,12/1/2010 8:41,22.65,17865
21745,GLASS STAR FROSTED T-LIGHT HOLDER,21,12/1/2010 8:41,19.25,17865
22648,HAND WARMER UNION JACK,21,12/1/2010 8:43,16.85,17865
22647,HAND WARMER RED POLKA DOT,21,12/1/2010 8:43,16.85,17865
84894,ASSORTED COLOUR BIRD ORNAMENT,47,12/1/2010 8:49,16.69,13062
22760,POPPY'S PLAYHOUSE BEDROOM ,21,12/1/2010 8:49,17.1,13062
22763,POPPY'S PLAYHOUSE KITCHEN,21,12/1/2010 8:49,17.1,13062
22764,FELTCRAFT PRINCESS CHARLOTTE DOLL,23,12/1/2010 8:49,18.75,13062
22325,IVORY KNITTED MUG COSY ,21,12/1/2010 8:49,16.65,13062
84984,BOX OF 6 ASSORTED COLOUR TEASPOONS,21,12/1/2010 8:49,19.25,13062
22638,BOX OF VINTAGE JIGSAW BLOCKS ,18,12/1/2010 8:49,19.95,13062
22637,BOX OF VINTAGE ALPHABET BLOCKS,17,12/1/2010 8:49,24.95,13062
21769,HOME BUILDING BLOCK WORD,18,12/1/2010 8:49,20.95,13062
21770,LOVE BUILDING BLOCK WORD,18,12/1/2010 8:49,20.95,13062
21792,RECIPE BOX WITH METAL HEART,19,12/1/2010 8:49,22.95,13062
48202,DOORMAT NEW ENGLAND,19,12/1/2010 8:49,22.95,13062
22975,JAM MAKING SET WITH JARS,21,12/1/2010 8:49,19.25,13062
22928,RED COAT RACK PARIS FASHION,18,12/1/2010 8:49,19.95,13062
22927,YELLOW COAT RACK PARIS FASHION,18,12/1/2010 8:49,19.95,13062
22929,BLUE COAT RACK PARIS FASHION,18,12/1/2010 8:49,19.95,13062
21771,BATH BUILDING BLOCK WORD,18,12/1/2010 8:50,20.95,13062
22743,ALARM CLOCK BAKELIKE PINK,39,12/1/2010 8:60,18.75,12598
22742,ALARM CLOCK BAKELIKE RED ,39,12/1/2010 8:60,18.75,12598
22741,ALARM CLOCK BAKELIKE GREEN,27,12/1/2010 8:60,18.75,12598
21739,PANDA AND BUNNIES STICKER SHEET,27,12/1/2010 8:60,15.85,12598
21898,STARS GIFT TAPE ,39,12/1/2010 8:60,15.65,12598
10017,INFLATABLE POLITICAL GLOBE ,63,12/1/2010 8:60,15.85,12598
21806,VINTAGE HEADS AND TAILS CARD GAME ,39,12/1/2010 8:60,16.25,12598
21050,SET/2 RED RETROSPOT TEA TOWELS ,33,12/1/2010 8:60,17.95,12598
22341,ROUND SNACK BOXES SET OF4 WOODLAND ,39,12/1/2010 8:60,17.95,12598
22644,SPACEBOY LUNCH BOX ,39,12/1/2010 8:60,16.95,12598
22674,LUNCH BOX I LOVE LONDON,39,12/1/2010 8:60,16.95,12598
22646,CIRCUS PARADE LUNCH BOX ,39,12/1/2010 8:60,16.95,12598
22676,CHARLOTTE BAG DOLLY GIRL DESIGN,35,12/1/2010 8:60,15.85,12598
21746,RED TOADSTOOL LED NIGHT LIGHT,39,12/1/2010 8:60,16.65,12598
22915, SET 2 TEA TOWELS I LOVE LONDON ,39,12/1/2010 8:60,17.95,12598
21928,VINTAGE SEASIDE JIGSAW PUZZLES,27,12/1/2010 8:60,18.75,12598
22555,MINI JIGSAW CIRCUS PARADE ,39,12/1/2010 8:60,15.42,12598
22559,MINI JIGSAW SPACEBOY,39,12/1/2010 8:60,15.42,12598
22507,MINI PAINT SET VINTAGE ,51,12/1/2010 8:60,15.65,12598
POST,POSTAGE,18,12/1/2010 8:60,33,12598
22101,PAPER CHAIN KIT 50'S CHRISTMAS ,95,12/1/2010 9:15,17.55,13763
22647,HAND WARMER RED POLKA DOT,21,12/1/2010 9:16,16.85,17865
22648,HAND WARMER UNION JACK,21,12/1/2010 9:16,16.85,17865
85138A,WHITE HANGING HEART T-LIGHT HOLDER,21,12/1/2010 9:17,17.55,17865
71068,WHITE METAL LANTERN,21,12/1/2010 9:17,18.39,17865
84421B,CREAM CUPID HEARTS COAT HANGER,23,12/1/2010 9:17,17.75,17865
20694,EDWARDIAN PARASOL RED,21,12/1/2010 9:17,19.95,17865
37385,RETRO COFFEE MUGS ASSORTED,21,12/1/2010 9:17,16.06,17865
21886,SAVE THE PLANET MUG,21,12/1/2010 9:17,16.06,17865
21086,VINTAGE BILLBOARD DRINK ME MUG,21,12/1/2010 9:17,16.06,17865
21083,VINTAGE BILLBOARD LOVE/HATE MUG,21,12/1/2010 9:17,16.06,17865
82498,WOOD 2 DRAWER CABINET WHITE FINISH,17,12/1/2010 9:17,19.95,17865
82501,WOOD S/3 CABINET ANT WHITE FINISH,19,12/1/2010 9:17,21.95,17865
82497,WOODEN PICTURE FRAME WHITE FINISH,21,12/1/2010 9:17,17.1,17865
82509L,WOODEN FRAME ANTIQUE WHITE ,21,12/1/2010 9:17,17.55,17865
84044G,KNITTED UNION FLAG HOT WATER BOTTLE,21,12/1/2010 9:17,18.39,17865
84044E,RED WOOLLY HOTTIE WHITE HEART.,21,12/1/2010 9:17,18.39,17865
22767,SET 7 BABUSHKA NESTING BOXES,17,12/1/2010 9:17,22.65,17865
21745,GLASS STAR FROSTED T-LIGHT HOLDER,21,12/1/2010 9:17,19.25,17865
21273,VICTORIAN SEWING BOX LARGE,47,12/1/2010 9:24,25.95,15115
85138A,WHITE HANGING HEART T-LIGHT HOLDER,21,12/1/2010 9:47,17.55,17865
71068,WHITE METAL LANTERN,21,12/1/2010 9:47,18.39,17865
84421B,CREAM CUPID HEARTS COAT HANGER,23,12/1/2010 9:47,17.75,17865
20694,EDWARDIAN PARASOL RED,21,12/1/2010 9:47,19.95,17865
37385,RETRO COFFEE MUGS ASSORTED,21,12/1/2010 9:47,16.06,17865
21886,SAVE THE PLANET MUG,21,12/1/2010 9:47,16.06,17865
21086,VINTAGE BILLBOARD DRINK ME MUG,21,12/1/2010 9:47,16.06,17865
21083,VINTAGE BILLBOARD LOVE/HATE MUG,21,12/1/2010 9:47,16.06,17865
82498,WOOD 2 DRAWER CABINET WHITE FINISH,17,12/1/2010 9:47,19.95,17865
82501,WOOD S/3 CABINET ANT WHITE FINISH,19,12/1/2010 9:47,21.95,17865
82497,WOODEN PICTURE FRAME WHITE FINISH,21,12/1/2010 9:47,17.1,17865
82509L,WOODEN FRAME ANTIQUE WHITE ,21,12/1/2010 9:47,17.55,17865
84044G,KNITTED UNION FLAG HOT WATER BOTTLE,21,12/1/2010 9:47,18.39,17865
84044E,RED WOOLLY HOTTIE WHITE HEART.,21,12/1/2010 9:47,18.39,17865
22767,SET 7 BABUSHKA NESTING BOXES,17,12/1/2010 9:47,22.65,17865
21745,GLASS STAR FROSTED T-LIGHT HOLDER,21,12/1/2010 9:47,19.25,17865
22129,HOT WATER BOTTLE TEA AND SYMPATHY,63,12/1/2010 9:47,18.45,15306
21748,RED HANGING HEART T-LIGHT HOLDER,79,12/1/2010 9:47,17.55,15306
22647,HAND WARMER RED POLKA DOT,21,12/1/2010 9:49,16.85,17865
22648,HAND WARMER UNION JACK,21,12/1/2010 9:49,16.85,17865
